"2017-02-17","“Revista de Terapia Ocupacional” lança novo número: Publicação quadrimestral da Faculdade de Medicina traz trabalhos inéditos da área","Jornal da USP","http://jornal.usp.br/ciencias/ciencias-da-saude/revista-de-terapia-ocupacional-lanca-novo-numero/","Ciências da Saúde, Faculdade de Medicina, Revista de Terapia Ocupacional, Saúde, Terapia Ocupacional"
"2017-02-15","Evento apresenta o Centro de Facilidades para a Pesquisa: Alunos de pós-graduação e iniciação científica poderão conhecer as instalações e atividades do centro no ICB","Jornal da USP","http://jornal.usp.br/ciencias/ciencias-biologicas/instituto-de-ciencias-biomedicas-promove-evento-para-estudantes/","Ciências Biológicas, Centro de Facilidades para a Pesquisa, Faculdade de Ciências Farmacêuticas, Faculdade de Medicina Veterinária e Zootecnia, Instituto de Ciências Biomédicas"
"2017-02-14","Revista de enfermagem discute cobertura universal da saúde: Periódico ressalta a importância da enfermagem para resolução de metas da ONU","Jornal da USP","http://jornal.usp.br/ciencias/ciencias-da-saude/revista-de-enfermagem-discute-cobertura-universal-da-saude/","Ciências da Saúde, EERP, Escola de Enfermagem de Ribeirão Preto, Revista Latino-Americana de Enfermagem, RLAE"
"2017-02-14","“Journal of Applied Oral Science” lança nova edição: Periódico editado pela Faculdade de Odontologia de Bauru publica artigos em inglês sobre avanços na área odontológica","Jornal da USP","http://jornal.usp.br/ciencias/ciencias-da-saude/journal-of-applied-oral-science-lanca-nova-edicao/","Ciências da Saúde, Faculdade de Odontologia de Bauru, Journal of Applied Oral Science, Odontologia, Periódico, Saúde"
"2017-02-14","Dieta materna influencia reprogramação do DNA do feto: Pesquisa confirma ação de dieta materna sobre função genética do filho relacionada a doenças cardiovasculares e diabete","Jornal da USP","http://jornal.usp.br/ciencias/ciencias-da-saude/dieta-materna-influencia-reprogramacao-do-dna-do-feto/","Ciências da Saúde, ácido fólico, diabete, doenças cardiovasculares, FMRP, genética, nutrologia, reprogramação epigenética"
"2017-02-14","Novo dispositivo óptico usa cristal líquido e é inspirado em besouro: Instituto de Física e Universidade Nova de Lisboa desenvolvem estrutura visando à comunicação ultrarrápida via luz","Jornal da USP","http://jornal.usp.br/ciencias/tecnologia/novo-dispositivo-optico-usa-cristal-liquido-inspirado-em-besouro/","Tecnologia, Advanced Materials, IF, Instituto de Física, Universidade Nova de Lisboa"
"2017-02-14","Exoesqueleto têxtil auxilia indivíduos a caminharem com mais eficiência: Vestimenta robótica foi desenvolvida para fins militares e pessoas com mobilidade reduzida","Jornal da USP","http://jornal.usp.br/ciencias/ciencias-da-saude/exoesqueleto-textil-auxilia-individuos-a-caminharem-com-mais-eficiencia/","Ciências da Saúde, Acidente Vascular Cerebral, Exoesqueleto Robótico, Exoesqueleto Têxtil, FMRP"
"2017-02-13","Placenta no início da gravidez é mais sensível à infecção por zika: Células da placenta nos três primeiros meses de gravidez possuem receptores que facilitam a entrada do vírus","Jornal da USP","http://jornal.usp.br/ciencias/ciencias-da-saude/placenta-no-inicio-da-gravidez-e-mais-sensivel-a-infeccao-por-zika/","Ciências da Saúde, gestação, Instituto Butantan, IQ, Microcefalia, placenta, São Paulo, vírus zika"
"2017-02-13","Parceria com Petrobras põe academia e indústria nos mesmos trilhos: Vínculo entre laboratório da USP e centro da Petrobras multiplica conhecimento e gera tecnologia para exploração de petróleo","Jornal da USP","http://jornal.usp.br/ciencias/ciencias-exatas-e-da-terra/parceria-com-petrobras-poe-academia-e-industria-nos-mesmos-trilhos/","Ciências Exatas e da Terra, Cenpe, IFSC, Instituto de Física de São Carlos, Laboratório de Espectroscopia de Alta Resolução por Ressonância Magnética, Lear, petrobras, petróleo, São Carlos"
"2017-02-10","Software indica os clientes com potencial de bons pagadores: Software que otimiza decisões para sistemas financeiros já pode ser comercializado para empresas de cobrança","Jornal da USP","http://jornal.usp.br/ciencias/ciencias-exatas-e-da-terra/pesquisa-de-mestrado-otimiza-decisoes-para-sistemas-financeiros/","Ciências Exatas e da Terra, Tecnologia, Centro de Ciências Matemáticas Aplicadas à Indústria, Instituto de Ciências Matemáticas e de Computação, Mestrado Profissional em Matemática Estatística e Computação Aplicadas à Indústria, pesquisa, software, tecnologia"
"2017-02-10","Estudo revela papel dos nervos simpáticos para saúde muscular: O papel do sistema nervoso simpático no tecido muscular vai muito além de controlar o fluxo sanguíneo","Jornal da USP","http://jornal.usp.br/ciencias/ciencias-biologicas/estudo-revela-papel-dos-nervos-simpaticos-para-saude-muscular/","Ciências Biológicas, Ciências da Saúde, Faculdade de Medicina de Ribeirão Preto, fisiologia, FMRP, Isis do Carmo Kettelhut, Luiz Carlos Carvalho Navegantes, Medicina, Nervos simpáticos, Saúde muscular"
"2017-02-10","Boletim sobre veterinária discute bem-estar de animais de produção: Publicação mensal da Faculdade de Medicina Veterinária e Zootecnia sugere leituras e eventos sobre este e outros assuntos","Jornal da USP","http://jornal.usp.br/ciencias/ciencias-biologicas/boletim-sobre-veterinaria-discute-bem-estar-de-animais-de-producao/","Ciências Biológicas, Boletim FMVZ, Faculdade de Medicina Veterinária e Zootecnia, FMVZ, Socioeconomia & Ciência Animal"
"2017-02-09","Não há nível de desmatamento seguro para o clima na Amazônia: Destruição da floresta interfere no transporte da umidade entre o oceano e o continente, alterando chuvas","Jornal da USP","http://jornal.usp.br/ciencias/ciencias-ambientais/nao-ha-nivel-de-desmatamento-seguro-para-o-clima-na-amazonia/","Ciências Ambientais, Amazônia, América do Sul, chuvas, Clima, IF, Redes Complexas, São Paulo, sistemas dinâmicos"
"2017-02-09","“Revista de História da Ciência” lança nova edição: Publicação reúne artigos de todas as áreas do conhecimento que registrem a trajetória da ciência","Jornal da USP","http://jornal.usp.br/ciencias/revista-de-historia-da-ciencia-lanca-nova-edicao/","Ciências, Centro Interunidades de História da Ciência, História da Ciência, Khronos — Revista de História da Ciência"
"2017-02-07","Evento na Poli apresentou avanços em tecnologia adaptativa: Softwares adaptativos podem mudar a função ou o comando original de outros para que eles obtenham melhor desempenho","Jornal da USP","http://jornal.usp.br/ciencias/tecnologia/evento-na-poli-apresentou-avancos-em-tecnologia-adaptativa/","Tecnologia, Adaptatividade, Departamento de Engenharia de Computação e Sistemas Digitais, EPUSP, Escola Politécnica, PCS, Poli, Workshop de Tecnologia Adaptativa, WTA"
"2017-02-07","Semente de jabuticaba é poderosa aliada na prevenção da obesidade: Caroço da fruta é rico em elagitaninos, substâncias que possuem ação anti-inflamatória e são eficazes contra a obesidade","Jornal da USP","http://jornal.usp.br/ciencias/ciencias-da-saude/semente-de-jabuticaba-e-poderosa-aliada-na-prevencao-da-obesidade/","Ciências da Saúde, Compostos Fenólicos, Elagitaninos, Faculdade de Ciências Farmacêuticas, FCF, Jabuticaba, Obesidade"
"2017-02-07","“Revista Brasileira de Educação Física e Esporte” publica novo número: Edição traz artigos sobre modalidades de treinamento e análises socioculturais e pedagógicas da educação física","Jornal da USP","http://jornal.usp.br/ciencias/ciencias-da-saude/treinamento-atletico-e-discutido-em-novo-numero-da-revista-brasileira-de-educacao-fisica-e-esporte/","Ciências da Saúde, Educação Física, Escola de Educação Física e Esporte, Esporte, Revista Brasileira de Educação Física e Esporte"
"2017-02-06","Paulo Artaxo Netto é vencedor do Prêmio Faz Diferença: Pesquisador do Instituto de Física venceu premiação do jornal <em>O Globo</em> na categoria Sociedade/Sustentabilidade","Jornal da USP","http://jornal.usp.br/ciencias/ciencias-ambientais/paulo-artaxo-netto-e-vencedor-do-premio-faz-diferenca/","Ciências Ambientais, Amazônia, Floresta Amazônica, Instituto de Física, mudanças climáticas, Nature, O Globo, Organização das Nações Unidas, pesquisa, Poluição Atmosférica, prêmio Faz Diferença 2016"
"2017-02-06","Estação centenária registra aumento da temperatura no interior: Posto Meteorológico da Esalq, em Piracicaba, mostra aumento de 1,5°C no último século e completa 100 anos de atividade","Jornal da USP","http://jornal.usp.br/ciencias/ciencias-ambientais/estacao-centenaria-registra-aumento-da-temperatura-no-interior/","Ciências Ambientais, Esalq, Escola Superior de Agricultura Luiz de Queiroz, Posto Meteorológico da Esalq, temperatura"
"2017-02-04","Inscrições abertas para prêmio de melhor tese em matemática: Iniciativa anual do Instituto de Ciências Matemáticas e de Computação é válida para trabalhos defendidos em 2016","Jornal da USP","http://jornal.usp.br/ciencias/ciencias-exatas-e-da-terra/inscricoes-abertas-para-premio-de-melhor-tese-em-matematica/","Ciências Exatas e da Terra, Instituto de Ciências Matemáticas e de Computação, Matemática, Prêmio, São Carlos, Tese de doutorado"
"2017-02-03","Curso de verão divulga pesquisas do Instituto de Física: Evento busca auxiliar estudantes em suas carreiras na pesquisa","Jornal da USP","http://jornal.usp.br/ciencias/ciencias-exatas-e-da-terra/curso-de-verao-divulga-pesquisas-do-instituto-de-fisica/","Ciências Exatas e da Terra, curso de verão, escola de verão, IF, Instituto de Física, Paulo Artaxo"
"2017-02-03","Pesquisador vem à USP estudar aplicações de modelos computacionais: Fluxo de capitais, dinâmica populacional e doenças infecciosas estão entre áreas em que modelos serão testados","Jornal da USP","http://jornal.usp.br/ciencias/pesquisador-vem-a-usp-estudar-aplicacoes-de-modelos-computacionais/","Ciências, cooperação interdisciplinar, Engenharia, Instituto de Estudos Avançados, Livro, Luiz Bevilacqua, Modelagem computacional, pesquisa, professor visitante"
"2017-02-03","Com quase 9 m de comprimento, o rei dos abelissaurídeos é brasileiro: Estudo classifica maior exemplar do gênero <em>pycnonemosaurus</em>, que há 70 milhões de anos habitava o Centro-Oeste","Jornal da USP","http://jornal.usp.br/ciencias/ciencias-biologicas/com-quase-9-m-de-comprimento-o-rei-dos-abelissaurideos-e-brasileiro/","Ciências Biológicas, Cretáceo, Dinossauro, História Natural, Museu de Zoologia, Paleontologia, pycnonemosaurus, Zoologia"
"2017-02-02","Magnetismo de materiais é medido em baixas temperaturas: Medições feitas com ressonância magnética nuclear devem ajudar no entendimento das propriedades físicas da matéria","Jornal da USP","http://jornal.usp.br/ciencias/ciencias-exatas-e-da-terra/magnetismo-de-materiais-e-medido-em-baixas-temperaturas/","Ciências Exatas e da Terra, Física, IF, magnetismo, Ressonância Magnética Nuclear"
"2017-02-02","Projeto piloto controla gestão de resíduos no interior paulista: Matão (SP) foi o primeiro município a testar sistema que organiza quantidade, origem e destino de material descartado","Jornal da USP","http://jornal.usp.br/ciencias/ciencias-ambientais/projeto-piloto-controla-gestao-de-residuos-no-interior-paulista/","Ciências Ambientais, CeMEAI, Centro de Ciências Matemáticas Aplicadas à Indústria, ICMC, Instituto de Ciências Matemáticas e Computação, SISGERES, Sistema de Gestão de Resíduos Sólidos"
"2017-02-01","Cientista da Inglaterra fala de inovações para um “futuro verde”: Famoso por canal de ciência no Youtube, Martyn Poliakoff participou de encontro de química","Jornal da USP","http://jornal.usp.br/ciencias/ciencias-exatas-e-da-terra/cientista-da-inglaterra-fala-de-inovacoes-para-um-futuro-verde/","Ciências Ambientais, Ciências Exatas e da Terra, Encontro Nacional dos Estudantes de Química, química verde, Universidade de Nottingham, USP Lecture"
"2017-02-01","Escolas de verão movimentam a Cidade Universitária nas férias: Eventos de humanas e de exatas reúnem estudantes de pós-graduação e professores universitários para aprimorarem conhecimentos","Jornal da USP","http://jornal.usp.br/ciencias/escolas-de-verao-movimentam-a-cidade-universitaria-nas-ferias/","Ciências, Cidade Universitária, Escola Politécnica, escolas de verão, Faculdade de Filosofia Letras e Ciências Humanas, Faculdade de Medicina, Férias, Infieri, Insitituto de Matemática e Estatística, Instituto de Astronomia Geofísica e Ciências Atmosféricas, Instituto de Física, Instituto de Relações Internacionais, IPSA-USP Summer School, summer school"
"2017-01-31","Inscrições abertas para auxílio a pesquisa nos acervos da USP: Pesquisadores contarão com auxílio por três meses para consulta ao material de diversas instituições da Universidade","Jornal da USP","http://jornal.usp.br/ciencias/inscricoes-abertas-para-auxilio-a-pesquisa-nos-acervos-da-usp/","Ciências, Acervo, Apoio ao Pesquisador, Biblioteca Brasiliana Guita e José Mindlin, Centro de Biologia Marinha, Inscrições, inscrições abertas, Insituto de Estudos Brasileiros, Museu de Arqueologia e Etnologia, Museu de Arte Contemporânea, Museu de Zoologia, Museu Paulista, Museus, pesquisa, Programa Institucional de Pesquisa nos Acervos da USP"
"2017-01-31","Cientista mostra poder dos jogos e do virtual na ciência e museus: Christian Stein, fundador do Gamelab Berlin, estará na USP, dia 2 de fevereiro, para apresentar projetos","Jornal da USP","http://jornal.usp.br/ciencias/tecnologia/cientista-mostra-poder-dos-jogos-e-do-virtual-na-ciencia-e-museus/","Tecnologia, Christian Stein, Gamelab Berlin, IEA, Realidade virtual"
"2017-01-30","Defesa Civil de Santos é modelo para outras cidades, afirma pesquisa: De acordo com estudo, órgão está entre os mais avançados em termos de resiliência urbana, mas ainda pode melhorar","Jornal da USP","http://jornal.usp.br/ciencias/ciencias-ambientais/defesa-civil-de-santos-e-modelo-para-outras-cidades-afirma-pesquisa/","Ciências Ambientais, defesa civil, Escola Politécnica da USP, Poli, resiliência, Santos"
"2017-01-30","Modelo matemático ajuda a entender o zumbido no ouvido: Pesquisa tenta desvendar doença que acomete cerca de 20% da população mundial","Jornal da USP","http://jornal.usp.br/ciencias/ciencias-da-saude/modelo-matematico-ajuda-a-entender-o-zumbido-no-ouvido/","Ciências da Saúde, CeMEAI, ICMC, Instituto de Ciências Matemáticas e Computação, Tinnitus, zumbido"
"2017-01-30","Trabalho premiado propõe estratégia para verificar dados científicos: Artigo sobre proveniência de dados propõe a gestão e o reuso de informações para maior eficiência em pesquisas","Jornal da USP","http://jornal.usp.br/ciencias/tecnologia/trabalho-premiado-propoe-estrategia-para-verificar-dados-cientificos/","Tecnologia, conferência internacional, Departamento de Engenharia de Computação e Sistemas Digitais, Escola Politécnica da USP, PCS"
"2017-01-30","Departamento de Psiquiatria cria aplicativo para auxiliar médicos: Ferramenta possibilita consulta rápida sobre avaliação diagnóstica, tratamentos e diretrizes em saúde mental","Jornal da USP","http://jornal.usp.br/ciencias/ciencias-da-saude/departamento-de-psiquiatria-cria-aplicativo-para-auxiliar-medicos/","Ciências da Saúde, Aplicativo, Faculdade de Medicina, Faculdade de Medicina da USP, FMUSP, IPQ, Psiquiatria"
"2017-01-27","Astrônomos observam mais de cem sistemas binários de estrelas massivas: Cientistas realizaram o maior levantamento espectroscópico de sistemas binários de alta massa em galáxia satélite à Via Láctea","Jornal da USP","http://jornal.usp.br/ciencias/ciencias-exatas-e-da-terra/astronomos-observam-mais-de-cem-sistemas-binarios-de-estrelas-massivas/","Ciências Exatas e da Terra, 30 Doradus, ESO, Grande Nuvem de Magalhães, IAG, sistemas binários, Tarântula, VLT"
"2017-01-27","Técnica cirúrgica reconstrói danos de tumor na região perianal: Especialistas da USP aprovam técnica de cirurgia plástica para reconstrução de defeitos causados por tumores perianais","Jornal da USP","http://jornal.usp.br/ciencias/ciencias-da-saude/tecnica-cirurgica-reconstroi-danos-de-tumor-na-regiao-perianal/","Ciências da Saúde, ânus, cirurgia plástica, FMRP, reconstrução de defeitos da retirada de tumores, reto, tumor perianal"
"2017-01-27","Evento promove troca de experiências para redução do efeito estufa: Workshop reunirá academia, governo e organizações para discutir cenários no setor de energia e emissões de gases","Jornal da USP","http://jornal.usp.br/ciencias/ciencias-exatas-e-da-terra/evento-promove-troca-de-experiencias-para-reducao-do-efeito-estufa/","Ciências Exatas e da Terra, efeito estufa, Escola Politécnica, Fapesp, Gás Natural, gases do efeito estufa, Workshop"
"2017-01-27","Internet das coisas é um dos temas da nova edição da revista “Jistem”: A revista traz artigos acadêmicos nas áreas de Sistemas de Informação, Tecnologia da Informação e Ciência da Informação","Jornal da USP","http://jornal.usp.br/ciencias/tecnologia/sistemas-de-informacao-e-internet-das-coisas-sao-temas-de-nova-edicao-da-revista-jistem/","Tecnologia, Faculdade de Economia Administração e Contabilidade, FEA, Internet das coisas, JISTEM, Laboratório de Gestão da Tecnologia e Sistemas de Informação, Tecnologia da Informação"
"2017-01-26","Partículas emitidas por veículos interferem na formação de chuvas: Poluição e urbanização da região metropolitana de São Paulo prejudicam a formação de chuvas leves","Jornal da USP","http://jornal.usp.br/ciencias/ciencias-ambientais/particulas-emitidas-por-veiculos-interferem-na-formacao-de-chuvas/","Ciências Ambientais, chuvas, IAG, IGc, Instituto de Astronomia Geofísica e Ciências Atmosféricas, Instituto de Geociências, Poluição Atmosférica"
"2017-01-26","USP e UFSCar discutem pesquisa em educação matemática: Evento busca contribuir para o desenvolvimento das teorias e práticas educacionais na área","Jornal da USP","http://jornal.usp.br/ciencias/ciencias-exatas-e-da-terra/usp-e-ufscar-discutem-pesquisa-em-educacao-matematica/","Ciências Exatas e da Terra, educação matemática, Fórum de Discussão – Parâmetros Balizadores da Pesquisa em Educação Matemática, ICMC, Instituto de Ciências Matemáticas e Computação, São Carlos"
"2017-01-26","USP pesquisa qualidade da água em Monte Negro (RO): Biólogos em expedição verificam se os rios da região podem estar contaminados ou poluídos","Jornal da USP","http://jornal.usp.br/ciencias/ciencias-da-saude/usp-pesquisa-qualidade-da-agua-em-monte-negro/","Ciências da Saúde, Rádio USP, Água, FOB, ICB5, Monte Negro, Projeto FOB USP em Rondônia, Rondônia"
"2017-01-24","Melatonina pode ajudar tratamento de mulheres com infertilidade: Hormônio regula o sono e atua na formação de novos vasos sanguíneos em células do ovário","Jornal da USP","http://jornal.usp.br/ciencias/ciencias-da-saude/hormonio-pode-ajudar-no-tratamento-de-mulheres-com-infertilidade/","Ciências da Saúde, Faculdade de Medicina, fertilidade, FM, FMUSP, hormônios, infertilidade"
"2017-01-23","Índice calcula consumo de alimentos que protegem o coração: Sistema atribui pontuação e permite acompanhar a adequação da dieta à saúde cardíaca","Jornal da USP","http://jornal.usp.br/ciencias/ciencias-da-saude/indice-calcula-consumo-de-alimentos-que-protegem-o-coracao/","Ciências da Saúde, Alimentação, DICA Br, FSP, São Paulo"
"2017-01-23","Medidas de raios cósmicos podem ajudar a entender matéria escura: Operação internacional registrou bilhões de eventos de raios cósmicos e detectou antimatéria","Jornal da USP","http://jornal.usp.br/ciencias/ciencias-exatas-e-da-terra/medidas-de-raios-cosmicos-podem-ajudar-a-entender-materia-escura/","Ciências Exatas e da Terra, antimatéria, IFSC, Instituto de Física de São Carlos, Manuela Vecchi, Raio cósmico, São Carlos"
"2017-01-20","Cientistas da Califórnia fazem visita à USP em São Carlos: Grupo da Universidade de Fullerton já conhecia o Instituto de Ciências Matemáticas e de Computação e planeja trabalhos em conjunto","Jornal da USP","http://jornal.usp.br/ciencias/ciencias-exatas-e-da-terra/pesquisadores-da-california-fazem-visita-a-usp-em-sao-carlos/","Ciências Exatas e da Terra, Centro de Ciências Matemáticas Aplicadas à Indústria, estados unidos, Instituto de Ciências Matemáticas e de Computação, Matemática, São Carlos"
"2017-01-20","Ar-condicionado individual pode melhorar o clima nos escritórios: Professora que criou o sistema diz que ele é mais econômico e saudável e busca investidores para produção em larga escala","Jornal da USP","http://jornal.usp.br/ciencias/tecnologia/ar-condicionado-individual-pode-melhorar-o-clima-nos-escritorios/","Tecnologia, ar-condicionado, Clima, Escola Politécnica, inovação, tecnologia, trabalho"
"2017-01-20","Radiotelescópio ajudará a desvendar “lado escuro” do Universo: Projeto com a participação de físicos da USP será construído no Uruguai","Jornal da USP","http://jornal.usp.br/ciencias/ciencias-exatas-e-da-terra/radiotelescopio-ajudara-a-desvendar-lado-escuro-do-universo/","Ciências Exatas e da Terra, Astrofísica, bingo, Energia Escura, IF, Instituto de Física, Matéria escura, radiotelescópio"
"2017-01-19","Cientistas descobrem poderosa colisão cósmica dupla: Com participação de brasileiros, descoberta rendeu capa da edição inaugural da revista <em>""Nature Astronomy""</em>","Jornal da USP","http://jornal.usp.br/ciencias/ciencias-exatas-e-da-terra/cientistas-descobrem-poderosa-colisao-cosmica-dupla/","Ciências Exatas e da Terra, Aglomerado de Galáxias, Astronomia, Felipe Andrade-Santos, galaxias, IAG, Instituto de Astronomia Geofísica e Ciências Atmosféricas, Rafael Miloni Santucci, Vinicius Placco"
"2017-01-19","Medicina de Ribeirão Preto publica nova edição de revista: Principais temas tratados nesta edição se referem a geriatria e oncologia","Jornal da USP","http://jornal.usp.br/ciencias/ciencias-da-saude/medicina-de-ribeirao-preto-publica-nova-edicao-de-revista/","Ciências da Saúde, Faculdade de Medicina de Ribeirão Preto, FMRP, Medicina, Publicação, Revista"
"2017-01-19","Lixo industrial gera renda quando manejo é feito em rede: Estudo mostra que boa gestão de resíduos da produção pode dar lucro, além de proteger o ambiente","Jornal da USP","http://jornal.usp.br/ciencias/ciencias-humanas/lixo-industrial-gera-renda-quando-manejo-e-feito-em-rede/","Ciências Ambientais, Ciências Humanas, FEARP, reciclagem, rede de empresas, Resíduos sólidos, Rodrigo Villa Lobos D’Amico, Rogério Ceravolo Calia"
"2017-01-19","InCor reúne profissionais para debater inovações em saúde: Encontro internacional discutirá avanços na cardiologia e áreas relacionadas","Jornal da USP","http://jornal.usp.br/ciencias/ciencias-da-saude/incor-reune-profissionais-para-debater-inovacoes-em-saude/","Ciências da Saúde, cardiologia, Cardiovascular, Faculdade de Medicina, Faculdade de Medicina da USP, FM, FMUSP, HC, Hospital das Clinicas, Incor, Instituto do Coração, Pneumologia"
"2017-01-19","Peixe-zebra é testado como modelo para experimentos com anestésico: Espécie <em>Danio rerio</em> possui similaridades genéticas com humanos e fornece respostas robustas","Jornal da USP","http://jornal.usp.br/ciencias/ciencias-biologicas/peixe-zebra-e-testado-como-modelo-para-experimentos-com-anestesico/","Ciências Biológicas, cetamina, Danio rerio, Drogas, FFLCRP, Zebrafish"
"2017-01-18","Visão sobre depressão sofreu transformações ao longo da história: Livro “A história da melancolia” mostra como o modo de encarar a depressão e a loucura se transformou no Ocidente","Jornal da USP","http://jornal.usp.br/ciencias/visao-sobre-depressao-sofreu-transformacoes-ao-longo-da-historia/","Ciências, A história da melancolia, depressão, Faculdade de Medicina da USP, FMUSP, loucura, Matheus Schumaker Emilio, melancolia, Táki Athanássios Cordás"
"2017-01-18","“Revista de Medicina” tem nova edição disponível: Publicação trismestral traz artigos e relatos de casos de interesse de profissionais e estudantes da área médica","Jornal da USP","http://jornal.usp.br/ciencias/ciencias-da-saude/revista-de-medicina-tem-nova-edicao-disponivel/","Ciências da Saúde, Faculdade de Medicina, FMUSP, Medicina, Periódico, Revista de Medicina, Saúde"
"2017-01-18","Evento on-line tem palestras gratuitas sobre sexualidade na saúde: Congresso trata da atuação do profissional de saúde nas questões de sexualidade","Jornal da USP","http://jornal.usp.br/ciencias/ciencias-da-saude/evento-on-line-tem-palestras-gratuitas-sobre-sexualidade-na-saude/","Ciências da Saúde, Congresso Online de Sexualidade, on line, Saúde, Sexualidade"
"2017-01-18","Processamento mínimo de hortaliças é tema de publicação da Esalq: Cartilha traz informações sobre cuidados para evitar a deterioração de alimentos","Jornal da USP","http://jornal.usp.br/ciencias/ciencias-agrarias/processamento-minimo-de-hortalicas-e-tema-de-publicacao-da-esalq/","Ciências Agrárias, Agricultura, Esalq, Escola Superior de Agricultura Luiz de Queiroz, hortaliças, Piracicaba, Produtor Rural, Publicações"
