"2016-11-23","Mudanças climáticas têm grande impacto nos oceanos: Professora Ilana Wainer, do Instituto Oceanográfico, ministrou palestra na Fapesp Week Montevideo e explicou o papel do oceano Ártico (Austral) nas mudanças climáticas","Jornal da USP","http://jornal.usp.br/ciencias/ciencias-exatas-e-da-terra/mudancas-climaticas-tem-grande-impacto-no-oceano-austral/","Ciências Exatas e da Terra, Aquecimento Global, Fapesp, Fapesp Week Montevideo, Instituto Oceanográfico, IO, mudanças climáticas, oceano austral"
"2016-11-23","Substâncias de organismos marinhos poderão ser usadas em protetor solar: O estudo foi feito com fungos e algas marinhas encontrados em Ubatuba, litoral norte brasileiro, e na Antártida","Jornal da USP","http://jornal.usp.br/ciencias/ciencias-da-saude/substancias-de-organismos-marinhos-podem-ser-usadas-em-protetores-solares/","Ciências da Saúde, Algas Marinhas, Fotoprotetor, fungos, Fungos Endófiticos, Microrganismos, Protetor Solar"
"2016-11-23","Trabalho da USP de São Carlos é destaque em congresso de Engenharia Biomédica: Trabalho de aluno da Escola de Engenharia de São Carlos é classificado como a melhor iniciação científica do congresso","Jornal da USP","http://jornal.usp.br/ciencias/trabalho-da-usp-sao-carlos-e-destaque-em-congresso-de-engenharia-biomedica/","Ciências, Congresso Brasileiro de Engenharia Biomédica, EESC, Escola de Engenharia de São Carlos, Fabrício de Almeida Brito, Marcelo Andrade da Costa Vieira"
"2016-11-23","Campus de Piracicaba vai sediar Museu de Logística: Projeto terá acervo formado a partir de doações de empresas ligadas ao setor logístico e deverá ser inaugurado em 2017","Jornal da USP","http://jornal.usp.br/ciencias/ciencias-exatas-e-da-terra/campus-de-piracicaba-vai-sediar-museu-de-logistica/","Ciências Exatas e da Terra, Ciências Humanas, Esalq, Escola Superior de Agricultura Luiz de Queiroz, Museu de Logística Luiz de Queiroz, Transporte"
"2016-11-23","Livro “História da Melancolia” será lançado no dia 25 de novembro: Os autores Táki Cordás, do Instituto de Psiquiatria, e o historiador Matheus Schumaker Emílio apresentam uma análise sobre a compreensão da melancolia ao longo da história","Jornal da USP","http://jornal.usp.br/ciencias/livro-historia-da-melancolia-sera-lancado-no-dia-25-de-novembro/","Ciências, História da Melancolia, Instituto de Psiquiatria da USP, IPQ, Lançamento de livro"
"2016-11-23","Lançamento de livro marca homenagem ao professor Leopoldo Magno Coutinho: Livro ""Biomas Brasileiros"" será lançado em 6 de dezembro durante homenagem ao professor Leopoldo Magno Coutinho, que morreu em fevereiro de 2016","Jornal da USP","http://jornal.usp.br/ciencias/lancamento-de-livro-marca-homenagem-ao-professor-leopoldo-magno-coutinho/","Ciências, Biomas Brasileiros, Cerrado, Evento de homenagem, IB, Instituto de Biociências, Leopoldo Magno Coutinho"
"2016-11-23","Lançada nova edição da revista “Pós.”: O periódico da Faculdade de Arquitetura e Urbanismo traz material de interesse para profissionais e estudiosos de arquitetura e urbanismo","Jornal da USP","http://jornal.usp.br/ciencias/lancada-nova-edicao-da-revista-pos/","Ciências, arquitetura, Faculdade de Arquitetura e Urbanismo, FAU, Pós. Revista do Programa de Pós-Graduação em Arquitetura e Urbanismo, Urbanismo"
"2016-11-22","Simulador de mama ajuda no treinamento de procedimentos médicos: Desenvolvido pelos pesquisadores Michelle Ferreira da Costa Abrahão e Felipe Wilker Grilo, o phantom de mama ajuda os profissionais de saúde no treinamento do procedimento de biópsia e intervenções cirúrgicas guiadas por ultrassom","Jornal da USP","http://jornal.usp.br/ciencias/ciencias-da-saude/simulador-de-mama-ajuda-a-treinar-procedimentos-medicos/","Ciências da Saúde, biópsia, câncer de mama, FFCLRP, GIIMUS, Gphantom, phantom de mama, PVC, simulador, treinamento, ultrassom"
"2016-11-21","À procura de olhos para robô, cientistas criam prótese de olho humano que pisca: Ainda em protótipo, sistema patenteado foi desenvolvido por meio de uma parceria entre a Faculdade de Odontologia e a Escola Politécnica","Jornal da USP","http://jornal.usp.br/ciencias/ciencias-da-saude/a-procura-de-olhos-para-robo-cientistas-criam-protese-de-olho-humano-que-pisca/","Ciências da Saúde, Tecnologia, Escola Politécnica, Faculdade de Odontologia, FO, Poli, Próteses Óculo-Palpebrais"
"2016-11-21","Trabalhos da USP São Carlos são premiados em Congresso: Dois trabalhos do Instituto de Ciências Matemáticas e de Computação foram premiados no Congresso Brasileiro de Informática na Educação, que ocorreu no final de outubro","Jornal da USP","http://jornal.usp.br/ciencias/trabalhos-da-usp-sao-carlos-sao-premiados-em-congresso/","Ciências, ICMC, Instituto de Ciências Matemáticas e de Computação, USP São Carlos, V Congresso Brasileiro de Informática na Educação"
"2016-11-21","Lançado novo volume da “Revista de Cultura e Extensão USP”: O periódico busca estabelecer um diálogo entre a USP e a sociedade através da divulgação de atividades de cultura e extensão","Jornal da USP","http://jornal.usp.br/ciencias/lancado-novo-volume-da-revista-de-cultura-e-extensao-usp/","Ciências, Cultura e Extensão, PRCEU, Pró-Reitoria de Cultura e Extensão Universitária, Revista de Cultura e Extensão USP"
"2016-11-21","Desmatamento estimula cães a se deslocarem para áreas de mata nativa: Presença de cachorros em áreas remanescentes de mata atlântica é mais comum que a de espécies nativas de animais carnívoros, como onça e jaguatirica","Jornal da USP","http://jornal.usp.br/ciencias/ciencias-biologicas/desmatamento-estimula-caes-a-se-deslocarem-para-areas-de-mata-nativa/","Ciências Biológicas, Cachorros, IB, mata atlântica, São Paulo"
"2016-11-21","Monitoramento voluntário mostra fatores que interferem na qualidade da água de rios: Dados obtidos por mil voluntários na análise de 150 rios em 4 países mostram efeito da vegetação e do lançamento de esgotos sobre nível de nutrientes das águas","Jornal da USP","http://jornal.usp.br/ciencias/ciencias-ambientais/monitoramento-voluntario-ajuda-a-entender-fatores-que-interferem-na-qualidade-da-agua-dos-rios/","Ciências Ambientais, EESC, Instituto Earthwatch, nutrientes, projeto FreshWater Watch, rios, São Carlos"
"2016-11-18","9ª Conferência Global de Promoção da Saúde ocorre dia 20: O professor Marco Akerman, da  Faculdade de Saúde Pública, representa a Região das Américas na Conferência da Organização Mundial da Saúde","Jornal da USP","http://jornal.usp.br/ciencias/ciencias-da-saude/9a-conferencia-global-de-promocao-da-saude-ocorre-dia-20/","Ciências da Saúde, 9ª conferência global de promoção da sáude, Faculdade de Saúde Pública, FPS, Marco Akerman, OMS, Organização Mundial da Saúde"
"2016-11-18","Lançada nova edição da revista “Medicina”: Com periodicidade trimestral, a revista acaba de lançar sua publicação de número 4","Jornal da USP","http://jornal.usp.br/ciencias/lancada-nova-edicao-da-revista-medicina-ribeirao-preto-online/","Ciências, Faculdade de Medicina de Ribeirão Preto, FMRP-USP, Medicina (Ribeirão Preto. Online)"
"2016-11-18","Evento na Fapesp comemora centenário da Academia Brasileira de Ciência: Evento será no dia 23 de novembro em São Paulo e trará debates sobre ciência e tecnologia","Jornal da USP","http://jornal.usp.br/ciencias/fapesp-realiza-evento-para-comemorar-centenario-da-academia-brasileira-de-ciencia/","Ciências, Academia Brasileira de Ciência, centenário, Fapesp, simpósio científico"
"2016-11-18","USP realiza o primeiro levantamento demográfico de gêmeos de São Paulo: Os dados foram apresentados no primeiro encontro sobre gêmeos realizado pela USP na Cidade Universitária","Jornal da USP","http://jornal.usp.br/ciencias/ciencias-biologicas/usp-realiza-o-primeiro-levantamento-demografico-de-gemeos-de-sao-paulo/","Ciências Biológicas, Ciências Humanas, Comportamento de Gêmeos, Gêmeos, gravidez, Instituto de Psicologia, Levantamento"
"2016-11-18","Percepção de justiça de preço pode ser alterada de acordo com o produto e sua forma de apresentação: O trabalho desenvolvido na FEA relaciona alterações no valor de um item com outros fatores através da coleta de dados comportamentais e neurofisiológicos de potenciais consumidores","Jornal da USP","http://jornal.usp.br/ciencias/percepcao-de-justica-de-preco-pode-ser-alterada-de-acordo-com-o-produto-e-sua-forma-de-apresentacao/","Ciências, Faculdade de Economia Administração e Contabilidade, FEA, Marketing, Percepção de Justiça de Preço"
"2016-11-17","Física da poluição do ar é tema de palestra de especialista da Universidade de Lyon: A visita de Christian George é parte de um projeto de cooperação internacional da Pró-Reitoria de Pesquisa","Jornal da USP","http://jornal.usp.br/ciencias/fisica-da-poluicao-do-ar-e-tema-de-palestra-de-especialista-da-universidade-de-lyon/","Ciências, Christian George, IF, Instituto de Física, IRCELYON, Química heterogênea de aerossóis"
"2016-11-17","Estudo traça perfil do ciclismo na cidade de São Paulo em diferentes períodos: Artigo apresenta as correlações, tendências temporais e consequências para a saúde na utilização de bicicleta na cidade","Jornal da USP","http://jornal.usp.br/ciencias/ciencias-humanas/estudo-traca-perfil-do-ciclismo-na-cidade-de-sao-paulo-em-diferentes-periodos/","Ciências da Saúde, Ciências Humanas, ciclismo, cidade de São Paulo, Faculdade de Saúde Pública, FSP, Thiago Hérick de Sá, University of Cambridge School of Clinical Medicine, University of Illinois"
"2016-11-17","Lançada nova edição da revista “Boletim de Botânica”: O volume 34 da revista traz seis artigos com foco no Estado de Minas Gerais","Jornal da USP","http://jornal.usp.br/ciencias/lancada-nova-edicao-da-revista-boletim-de-botanica/","Ciências, IB-USP, Instituto de Biociências, Revista Boletim de Botânica"
"2016-11-17","ECA sedia lançamento do livro “Televisão: Tecnologia e Forma Cultural”: O evento trará debates sobre o autor Raymond Williams, sua obra e os temas tratados nessas publicações","Jornal da USP","http://jornal.usp.br/ciencias/eca-sedia-lancamento-do-livro-televisao-tecnologia-e-forma-cultural/","Ciências, ECA, Escola de Comunicações e Artes, Raymond Williams, Televisão"
"2016-11-16","Martin Grossmann analisa o Centro Cultural São Paulo como “crítica” ao Modernismo: ","Jornal da USP","http://jornal.usp.br/ciencias/martin-grossmann-analisa-o-centro-cultural-sao-paulo-como-critica-ao-modernismo/","Ciências"
"2016-11-16","Nanopartículas de magnetita matam células do câncer por superaquecimento: Encapsulado com uma nova técnica, material não tem efeito tóxico e pode destruir as células tumorais","Jornal da USP","http://jornal.usp.br/ciencias/ciencias-exatas-e-da-terra/nanoparticulas-de-magnetita-matam-celulas-do-cancer-por-superaquecimento/","Ciências Biológicas, Ciências Exatas e da Terra, Câncer, EESC, FMRP, IQSC, Nanopartículas"
"2016-11-11","Lançado arquivo on-line que reúne variações genéticas dos brasileiros: Banco de dados com 1,2 milhão de variantes genômicas mapeia a variabilidade existente no Brasil, auxiliando estudos sobre herança genética, envelhecimento e origem de doenças","Jornal da USP","http://jornal.usp.br/ciencias/ciencias-biologicas/lancado-arquivo-on-line-que-reune-variacoes-geneticas-dos-brasileiros/","Ciências Biológicas, Ciências da Saúde, ABraOM, CEGH-CEL, exoma, FSP, genética, Genoma, IB, Idosos, Projeto SABE, São Paulo"
"2016-11-11","Sapos têm crânios alterados em resposta às mudanças climáticas: Estudo indica que alterações no clima atuam sobre a morfologia craniana de um grupo de sapos, que se adaptam para sobreviver em ambientes mais secos ou mais úmidos","Jornal da USP","http://jornal.usp.br/ciencias/ciencias-biologicas/sapos-tem-cranios-alterados-em-resposta-as-mudancas-climaticas/","Ciências Biológicas, Adaptação, Biologia, evolução, Fabio de Andrade Machado, Gabriel Marroig Zambonato, IB, Instituto de Biociências, Monique Simon, Mudança climática, Sapo"
"2016-11-10","Descoberta de fósseis dá novas pistas sobre a origem dos dinossauros: Animais de cerca de 230 milhões de anos, encontrados no sul do Brasil, sugerem que os dinossauros e seus precursores viveram lado a lado, e que a ascensão dos dinossauros foi mais gradual","Jornal da USP","http://jornal.usp.br/ciencias/ciencias-biologicas/descoberta-de-fosseis-da-novas-pistas-sobre-a-origem-dos-dinossauros/","Ciências Biológicas, Buriolestes schultzi, descoberta, dinossauros, escavações, evolução, FFCLRP, Formação Santa Maria, fósseis, Ixalerpeton polesinensis, precursor de dinossauros, UFRJ, Ulbra, USP"
"2016-11-10","Falta de proteína da superfície do parasita da malária evita infecção do mosquito: Equipe de pesquisadores mostrou que proteína presente na superfície dos plasmódios desempenha papel essencial para que o parasita complete ciclo de vida","Jornal da USP","http://jornal.usp.br/ciencias/ciencias-da-saude/falta-de-proteina-da-superficie-do-parasita-da-malaria-evita-infeccao-do-mosquito/","Ciências da Saúde, Cell Host&Microbe, Instituto de Ciências Biomédicas, Malária, Mosquito Anófeles, Parasita"
"2016-11-10","Trabalhos da USP são premiados em evento nacional de robótica: O evento ""Robótica 2016"" reconheceu quatro trabalhos do Instituto de Ciências Matemáticas e Computação da USP","Jornal da USP","http://jornal.usp.br/ciencias/tecnologia/trabalhos-da-usp-sao-premiados-em-evento-nacional-de-robotica/","Tecnologia, ICMC, Instituto de Ciências Matemáticas e de Computação, Robótica 2016, USP São Carlos"
"2016-11-09","Nova estratégia contra a sepse combate inflamação e reduz mortalidade: Dois fármacos foram utilizados para inibir enzima a fim de combater a inflamação e reduzir a mortalidade de pacientes com sepse","Jornal da USP","http://jornal.usp.br/ciencias/ciencias-da-saude/nova-estrategia-contra-a-sepse-combate-inflamacao-e-reduz-mortalidade/","Ciências da Saúde, CRID, FMRP, IQ, medicamento, Redoxoma, Ribeirão Preto, São Paulo, sepse"
"2016-11-09","Biossensores apresentam potencial para medir glicose de modo contínuo: De acordo com os pesquisadores da USP em Ribeirão Preto, os dispositivos também abrem caminho para a criação de um pâncreas artificial","Jornal da USP","http://jornal.usp.br/ciencias/ciencias-biologicas/biossensores-apresentam-potencial-para-medir-glicose-de-modo-continuo/","Ciências Biológicas, Ciências da Saúde, células cancerígenas, Diabetes, extracelular, FFCLRP, físico médico biossensores de glicose, glicose, intracelular, Marcelo Mulato, monitoramento contínuo, pâncreas artificial, Raphael Aparecido Sanches Nascimento"
"2016-11-09","Institutos Nacionais de Ciência e Tecnologia sediados na USP receberão financiamento: USP conta com 17 projetos selecionados entre os 33 Institutos Nacionais de Ciência e Tecnologia (INCT) do Estado de São Paulo que receberão financiamento. Número total é de 101 projetos","Jornal da USP","http://jornal.usp.br/ciencias/comite-divulga-lista-dos-incts-que-receberao-financiamento/","Ciências, Fapesp, Financiamento, Fomento, INCTs, Instituto Nacional de Ciência e Tecnologia, Investimento, Política científica, USP"
"2016-11-09","Professor britânico fala sobre novos tratamentos para o Alzheimer: Conferência com o professor Foo Y. Eddy Liew, da Universidade de Glasgow, será no dia 10 de novembro, às 9 horas, na USP em Ribeirão Preto","Jornal da USP","http://jornal.usp.br/ciencias/professor-britanico-fala-sobre-novos-tratamentos-de-alzheimer/","Ciências, CRID, Doença de Alzheimer, FMRP, Foo Y. Eddy Liew, IEA-RP"
"2016-11-09","Falando de economia a robótica, Simpósio Brasil-Japão 2016 acontece na USP: Evento acontece dia 16 de novembro, na Biblioteca Brasiliana, e tem entrada franca","Jornal da USP","http://jornal.usp.br/ciencias/falando-de-economia-a-robotica-simposio-brasil-japao-2016-acontece-na-usp/","Ciências, Biblioteca Brasiliana Guita e José Mindlin, Ciência, Japão, Simpósio Brasil-Japão 2016, tecnologia, USP"
"2016-11-08","Enzima da levedura do pão pode ser alternativa para tratar leucemia infantil: Nos testes iniciais ""in vitro"", enzima descrita por pesquisadores da USP e da Unesp demonstrou potencial para matar as células tumorais","Jornal da USP","http://jornal.usp.br/ciencias/ciencias-biologicas/enzima-da-levedura-do-pao-pode-ser-alternativa-para-tratar-leucemia-infantil/","Ciências Biológicas, Ciências da Saúde, Adalberto Pessoa Júnior, biofármacos, enzima, Erwinia crisantemi, Escherichia coli, FCF, Gisele Monteiro, Iris Munhoz Costa, L-asparaginase, leucemia linfóide aguda infantil, Saccharomyces cerevisiae"
"2016-11-08","Pesquisa que propõe uso de adubo verde em canaviais é premiada: Método também permite maior eficiência no uso de fertilizantes, resultando em economia ao produtor","Jornal da USP","http://jornal.usp.br/ciencias/ciencias-agrarias/pesquisa-que-propoe-uso-de-adubo-verde-em-canaviais-e-premiada/","Ciências Agrárias, Ciências Ambientais, Adubo Verde, Esalq, Escola Superior de Agricultura Luiz de Queiroz, IPNI"
"2016-11-07","Alunos da USP ganham prêmio internacional microbiologia e higiene de alimentos: Trabalho produzido na Escola Superior de Agricultura Luiz de Queiroz foi apresentado em congresso em Medellín, na Colômbia","Jornal da USP","http://jornal.usp.br/ciencias/ciencias-biologicas/alunos-da-usp-ganham-premio-internacional-microbiologia-e-higiene-de-alimentos/","Ciências Biológicas, Ciências da Saúde, Esalq, Escola Superior de Agricultura Luiz de Queiroz, Getep, Higiene, ICMSF, International Commission on Microbiological Specification, Microbiologia de Alimentos, Pescado, Piracicaba"
"2016-11-07","Ganhador do Nobel fala das “maravilhas da física nas proximidades do zero absoluto”: Palestra, com entrada gratuita, será ministrada em São Carlos pelo ganhador do Nobel de Física de 1997, William Daniel Phillips","Jornal da USP","http://jornal.usp.br/ciencias/ciencias-exatas-e-da-terra/ganhador-do-nobel-fala-das-maravilhas-da-fisica-nas-proximidades-do-zero-absoluto/","Ciências Exatas e da Terra, Física, IFSC, Instituto de Física de São Carlos, nobel, William Daniel Phillips, zero absoluto"
"2016-11-07","Estudo reforça importância econômica da biomassa para América Latina e África: Uma reunião de 50 especialistas em bioenergia aponta para a capacidade de cultivo de biomassa em nível mundial nos dois continentes, mas há desafios","Jornal da USP","http://jornal.usp.br/ciencias/ciencias-agrarias/estudo-reforca-importancia-economica-da-biomassa-para-america-latina-e-africa/","Ciências Agrárias, Ciências Ambientais, Ciências Humanas, bioenergia, biomassa, Fapesp, Gláucia Mendes Souza, Instituto de Química, IQ-USP"
"2016-11-07","Técnica melhora processo de hidratação do feijão moyashi: Proposta é desenvolver processos mais eficientes para garantir aos consumidores alimento seguro e de maior qualidade","Jornal da USP","http://jornal.usp.br/ciencias/ciencias-agrarias/tecnica-melhora-processo-de-hidratacao-do-feijao-moyashi/","Ciências Agrárias, Ciência dos Alimentos, Esalq, Escola Superior de Agricultura Luiz de Queiroz, Tecnologia de Ultrassom"
"2016-11-07","Pesquisa investiga epidemia midiática de febre amarela: Pesquisadora investiga epidemia discursiva durante cobertura midiática de epizootia de febre amarela no verão de 2008","Jornal da USP","http://jornal.usp.br/ciencias/ciencias-humanas/pesquisa-investiga-epidemia-midiatica-de-febre-amarela/","Ciências da Saúde, Ciências Humanas, Angela Maria Belloni Cuenca, Cláudia Malinverni, Epidemia, Epizootia, Faculdade de Saúde Pública, Febre Amarela, FSP, Jornalismo, Saúde"
"2016-11-07","Algoritmo inspirado na evolução dá origem a código genético criado em computador: O estudo do código genético pode contribuir futuramente na produção de proteínas específicas importantes para as áreas biológica e farmacológica","Jornal da USP","http://jornal.usp.br/ciencias/ciencias-biologicas/algoritmo-inspirado-na-evolucao-da-origem-a-codigo-genetico-criado-em-computador/","Ciências Biológicas, Tecnologia, abordagem estatística, abordagem por engenharia, algoritmos, área biológica, área farmacológica, código canônico, código genético, computador, DCM, DNA, FFCLRP, processo evolutivo, propriedades, proteína sintética, Proteínas, robustez, USP"
"2016-11-07","Lançada nova edição da revista “Journal of Ancient Philosophy”, do Departamento de Filosofia da FFLCH: O periódico aborda temas de interesse para alunos e pesquisadores da área de Filosofia antiga","Jornal da USP","http://jornal.usp.br/ciencias/lancada-nova-edicao-da-revista-journal-of-ancient-philosophy-do-departamento-de-filosofia-da-fflch/","Ciências, Faculdade de Filosofia Letras e Ciências Humanas, FFLCH, Filosofia antiga, Journal of Ancient Philosophy"
"2016-11-07","Desenvolvimento de medicamentos e inovação serão tema de encontro: Iniciativa do programa Supernova, do Instituto de Ciências Biomédicas, aproxima universidade e indústria","Jornal da USP","http://jornal.usp.br/ciencias/desenvolvimento-de-medicamentos-e-inovacao-serao-tema-de-encontro/","Ciências, Drug Discovery Academia, ICB, International Symposium, ISDDA 2016"
"2016-11-07","Tecnologia usa laser aeroembarcado para monitorar a floresta: Em Piracicaba, o Grupo de Estudos em Tecnologias LidAR desenvolve de forma pioneira projetos florestais com dados gerados por instrumentos óticos","Jornal da USP","http://jornal.usp.br/ciencias/ciencias-exatas-e-da-terra/tecnologia-usa-laser-aeroembarcado-para-monitorar-a-floresta/","Ciências Ambientais, Ciências Exatas e da Terra, Esalq, Escola Superior de Agricultura Luiz de Queiroz, Laser, Monitoramento Florestal"
"2016-11-04","Pesquisador da USP vence o maior prêmio de imunologia da América Latina: Lucas Arruda recebeu o Prêmio Thereza Kipnis 2016 por sua pesquisa sobre esclerose sistêmica","Jornal da USP","http://jornal.usp.br/ciencias/ciencias-biologicas/pesquisador-da-usp-vence-o-maior-premio-de-imunologia-da-america-latina/","Ciências Biológicas, Ciências da Saúde, Centro de Terapia Celular, CTC, esclerose sistêmica, Faculdade de Medicina de Ribeirão Preto, FMRP, Lucas Arruda, Prêmio Thereza Kipnis 2016"
"2016-11-04","Comunicação de risco deve ser uma via de mão dupla, defendem especialistas: Governo e empresas devem informar a população sobre os reais riscos de suas atividades e saber dialogar com a comunidade.","Jornal da USP","http://jornal.usp.br/ciencias/comunicacao-de-risco-deve-ser-uma-via-de-mao-dupla-defendem-especialistas/","Ciências, TV USP, Catástrofe, Comunicação de Risco, Faculdade de Saúde Pública, Fukushima, Kwan-Hoong Ng, Risco"
"2016-11-04","Estudo destaca potencial do jucá contra rugas e manchas na pele: Ácido presente na planta evita que ações oxidantes degradem o tecido e contribuam para o envelhecimento da pele","Jornal da USP","http://jornal.usp.br/ciencias/ciencias-da-saude/estudo-destaca-potencial-do-juca-contra-rugas-e-manchas-na-pele/","Ciências da Saúde, antienvelhecimento, Faculdade de Ciências Farmacêuticas, FCF, jucá, Silvya Stuchi Maria-Engler, Tatiana do Nascimento Pedrosa, Ufam"
"2016-11-04","Astrônomos da USP descobrem super-Netuno e super-Terra em estrela gêmea do Sol: Equipe liderada pelo astrônomo Jorge Melendez também encontra evidências de planeta devorado por sua estrela","Jornal da USP","http://jornal.usp.br/ciencias/ciencias-exatas-e-da-terra/astronomos-da-usp-descobrem-super-netuno-e-super-terra-em-estrela-gemea-do-sol/","Ciências Exatas e da Terra, Astronomia, Instituto de Astronomia Geofísica e Ciências Atmosféricas, Jorge Melendez, Super-Netuno, Super-Terra"
"2016-11-03","Campus de Pirassununga terá Centro de Pesquisas em Nutrologia de Cães e Gatos: Com investimento total de R$ 2 milhões da empresa PremieR pet, o projeto do Cepen Pet será concluído no primeiro semestre de 2017","Jornal da USP","http://jornal.usp.br/ciencias/campus-de-pirassununga-tera-centro-de-pesquisas-em-nutrologia-de-caes-e-gatos/","Ciências, Centro de Pesquisas em Nutrologia de Cães e Gatos, Faculdade de Medicina Veterinária e Zootecnia, FMVZ, Nutrição Animal"
"2016-11-03","Pesquisador conta o que descobriu sobre os efeitos da poluição do ar: O vídeo traz o diretor do IEA, Paulo Saldiva, apresentando sua pesquisa sobre poluição do ar na cidade de São Paulo e impactos na saúde","Jornal da USP","http://jornal.usp.br/tv-usp/pesquisa-sobre-efeitos-da-poluicao-do-ar-na-saude-e-tema-de-video-da-fapesp/","Ciências da Saúde, TV USP, cidade de São Paulo, Faculdade de Medicina da USP, FMUSP, IEA, Instituto de Estudos Avançados, Paulo Saldiva, poluição do ar, Saúde"
"2016-11-03","Aumento no número de refeições está relacionado com obesidade no Brasil: Pesquisa aponta que o controle do tamanho da porção de determinados alimentos e do número de refeições pode auxiliar na prevenção e controle do excesso de peso","Jornal da USP","http://jornal.usp.br/ciencias/ciencias-da-saude/aumento-no-numero-de-refeicoes-pode-ser-uma-das-causas-da-obesidade-no-brasil/","Ciências da Saúde, Alimentos, Faculdade de Saúde Pública, FSP, Grupo de Pesquisa de Avaliação do Consumo Alimentar, Jaqueline Lopes Pereira, Nutrição, Obesidade, Regina Mara Fisberg"
