"2016-09-14","Novo número do Journal of Human Growth and Development é publicado: O periódico divulga trabalhos cujo objeto de estudo e discussão são as relações entre o crescimento e o desenvolvimento do ser humano","Jornal da USP","http://jornal.usp.br/ciencias/ciencias-da-saude/novo-numero-do-journal-of-human-growth-and-development-e-publicado/","Ciências da Saúde, Crecimento Humano, Desenvolvimento humano, FSP, Revista, Saúde Pública"
"2016-09-13","É preciso abandonar a noção de uma hierarquia entre as ciências, defende livro: Livro viaja pelo desenvolvimento histórico-filosófico das ciências enquanto propõe, de maneira crítica, que a interconexão das diversas disciplinas substitua a submissão de uma à outra","Jornal da USP","http://jornal.usp.br/ciencias/e-preciso-abandonar-a-nocao-de-uma-hierarquia-entre-as-ciencias-defende-livro/","Ciências, Filosofia, Filosofia da ciência, Interconnecting the sciences, Positivismo, Ribeiro Terra, Ricardo Ribeiro Terra, Walter"
"2016-09-13","Isolamento e desvalorização marcam emocional do homem com câncer de próstata: Pesquisa da Escola de Enfermagem de Ribeirão Preto mostra como o homem com câncer de próstata lida com a mudança de identidade e com a sensação de perda da masculinidade","Jornal da USP","http://jornal.usp.br/ciencias/ciencias-da-saude/isolamento-e-desavalorizacao-marcam-emocional-do-homem-com-cancer-de-prostata/","Ciências da Saúde, câncer de próstata, doença, EERP, fragilidade, homem, masculinidade, pesquisa, USP"
"2016-09-13","Livro reúne experiência de intelectuais brasileiros na Ciência da Informação e Biblioteconomia: Foi lançado no último dia 27, a obra Pensadores brasileiros da Ciência da Informação e Biblioteconomia, editora UFPB, 223 páginas, R$35,00, de autoria dos professores Solange Puntel Mostafa, Márcia Regina da Silva e José Eduardo Santarém Segundo, todos do DEDIC, da FFCLRP.","Jornal da USP","http://jornal.usp.br/ciencias/atualidades-0909-intelectuais-brasileiros-na-ciencia-da-informacao-e-biblioteconomia/","Ciências, Cultura, Biblioteconomia, biografias, Ciência da Informação, DEDIC, FFCLRP, história, Livro, pensadores brasileiros, percursos epistemológicos, UFPB, vigésima terceira Bienal Internacional do Livro de São Paulo"
"2016-09-12","Medicamento em teste na USP em Ribeirão Preto combate a hipertensão em sua origem: Composto controla o aumento da pressão nos casos relacionados à hiperatividade simpática; resultados de testes pré-clínicos foram divulgados na revista ""Nature Medicine""","Jornal da USP","http://jornal.usp.br/ciencias/ciencias-da-saude/medicamento-em-teste-na-usp-em-ribeirao-preto-combate-a-hipertensao-em-sua-origem/","Ciências da Saúde, Benedito Honorio Machado, Davi José de Almeida Moraes, Faculdade de Medicina de Ribeirão Preto, hipertensão, Julian Paton, Melina Pires da Silva, P2X3, Pressão alta"
"2016-09-09","Lançada nova edição da “Revista Medicina de Ribeirão Preto”: Em destaque, artigos sobre mobilidade dos idosos e sedentarismo dos adolescentes","Jornal da USP","http://jornal.usp.br/ciencias/ciencias-da-saude/lancada-nova-edicao-da-revista-medicina-de-ribeirao-preto/","Ciências da Saúde, adolescentes, FMRP, Idosos, Povos Indígenas, Revista Faculdade de Medicina de Ribeirão Preto, Tuberculose"
"2016-09-08","Cientistas criam rede mundial de informação sobre substâncias químicas: Cientistas colocam em funcionamento banco mundial de moléculas de produtos naturais. Sistema já é o segundo maior do mundo e o primeiro de livre acesso","Jornal da USP","http://jornal.usp.br/ciencias/cientistas-criam-rede-mundial-de-informacao-sobre-substancias-quimicas/","Ciências, espectometria, FCFRP, Global Natural Products Social Molecular Networking, GNPS, inorgânicos, orgânicos, recursos químicos, Rede Mundial de Material Molecular de Produtos Naturais"
"2016-09-07","Transplante de células-tronco é eficaz no tratamento da esclerose sistêmica: Estudo realizado no Centro de Terapia Celular comprova eficiência do transplante autólogo de células-tronco no tratamento da doença autoimune","Jornal da USP","http://jornal.usp.br/ciencias/ciencias-da-saude/transplante-de-celulas-tronco-e-eficaz-no-tratamento-da-esclerose-sistemica/","Ciências da Saúde, Células-tronco, CTC-Cepid, esclerose sistêmica, fibrose cutânea., FMRP, hematopoético, transplante autólogo"
"2016-09-06","Cientistas investigam origens de variantes do vírus da hepatite Delta no Nordeste brasileiro: Uma das variantes do vírus (HDV-8) era encontrada somente na África e, segundo os pesquisadores, pode ter chegado à região por uma das rotas do tráfico de escravos","Jornal da USP","http://jornal.usp.br/ciencias/ciencias-biologicas/cientistas-investigam-origens-de-variantes-do-virus-da-hepatite-delta-no-nordeste-brasileiro/","Ciências Biológicas, FM, genótipos, Hepatite B, Hepatite C, Hepatite Delta, Instituto de Medicina Tropical"
"2016-09-06","Parasita causador da malária se modifica para melhor viver nas Américas: Equipe de cientistas identifica amostras de Plasmodium vivax, um dos parasitas causadores da doença, com diferenças genéticas em relação aos encontrados nos continentes africano e asiático","Jornal da USP","http://jornal.usp.br/ciencias/ciencias-da-saude/parasita-causador-da-malaria-se-modifica-para-melhor-viver-nas-americas/","Ciências da Saúde, ICB, Malária, Nature Genetics, Parasita Plasmodium virax"
"2016-09-06","Tratamento experimental inibe  dor de animais com neuropatia diabética: A neuropatia diabética é uma das complicações crônicas mais comuns e incapacitantes em pessoas que sofrem de diabete","Jornal da USP","http://jornal.usp.br/ciencias/ciencias-biologicas/tratamento-experimental-inibe-dor-de-animais-com-neuropatia-diabetica/","Ciências Biológicas, Hemopressina, ICB, Mielina, Neuropatia Diabética FeSBE, Peptídio"
"2016-09-05","Pesquisa investiga uso de compostos da casca da romã para prevenção do Alzheimer: O extrato obtido da casca tem ação similar à de medicamento utilizado para tratar a doença de Alzheimer, ao inibir a enzima acetilcolinesterase, mas estudos em humanos precisam ser feitos para a confirmação","Jornal da USP","http://jornal.usp.br/ciencias/ciencias-biologicas/pesquisa-investiga-uso-de-compostos-da-casca-da-roma-para-prevencao-do-alzheimer/","Ciências Biológicas, Alzheimer, Antioxidantes, Esalq, Neorotransmissor, Romã"
"2016-09-05","Astrônomos brasileiros mapeiam estrutura de idades do halo da Via Láctea: O halo é um dos componentes galácticos que possuem tipicamente estrelas mais velhas e, portanto, é um ambiente fundamental para estudos que tentam descobrir indícios da origem e formação da Via Láctea","Jornal da USP","http://jornal.usp.br/ciencias/ciencias-exatas-e-da-terra/astronomos-brasileiros-mapeiam-estrutura-de-idades-do-halo-da-via-lactea/","Ciências Exatas e da Terra, Astronomia, IAG, São Paulo, via láctea"
"2016-09-02","Docente da Escola de Educação Física e Esportes (EEFE) é reconhecido por suas pesquisas com judô: Reconhecimento vei por intermédio da startup originada na Universidade de Oxford, no Reino Unido","Jornal da USP","http://jornal.usp.br/ciencias/docente-da-escola-de-educacao-fisica-e-esportes-eefe-e-reconhecido-por-suas-pesquisas-com-judo/","Ciências, EEFE, Judô, Universidade de Oxford, Wizdom.ai"
"2016-09-02","Mudanças climáticas são tema da Tarde Científica do Parque Cientec: O evento será ministrado por Flavio Berchez, professor do Instituto de Biociências (IB) da USP","Jornal da USP","http://jornal.usp.br/ciencias/ciencias-ambientais/mudancas-climaticas-sao-tema-da-tarde-cientifica-do-parque-cientec/","Ciências Ambientais"
"2016-09-02","R$ 1 de investimento em capital humano e pesquisa na agricultura rende R$ 12 para a economia: Cada R$ 1 de recursos públicos em pesquisa, educação superior e transferência de conhecimento na agropecuária paulista traz retorno de R$ 10 a R$ 12 para a economia do Estado","Jornal da USP","http://jornal.usp.br/ciencias/ciencias-agrarias/1-real-de-investimento-em-capital-humano-e-pesquisa-na-agricultura-rende-12-reais-para-a-economia/","Ciências Agrárias, Agropecuária, Esalq, FEARP, Piracicaba, Ribeirão Preto"
"2016-09-02","Para se proteger, vírus zika é capaz de modular inflamação no cérebro: Segundo cientista, essa modulação mantém a célula viva, e isso é bom para o vírus, que não quer matar o seu hospedeiro porque ele também sairia perdendo","Jornal da USP","http://jornal.usp.br/ciencias/ciencias-biologicas/para-se-proteger-virus-zika-e-capaz-de-modular-inflamacao-no-cerebro/","Ciências Biológicas, Ciências da Saúde, Cérebro, Fapep, FesBe, FMVZ, ICB, Microcefalia, Zika Vírus"
"2016-09-02","Problemas na diferenciação entre bebê e mãe podem originar anorexia no futuro: A restrição alimentar aparece como uma tentativa do indivíduo de controlar presença e ausência do objeto, que, no caso, aparece na forma de comida","Jornal da USP","http://jornal.usp.br/ciencias/ciencias-da-saude/problemas-na-diferenciacao-entre-bebe-e-mae-podem-originar-anorexia-no-futuro/","Ciências da Saúde, Anorexia, Bulimia, Psicologia, Revista psico.usp, transtorno alimentar"
"2016-09-02","Pesquisador da USP publica artigo sobre a relação entre zika, megaeventos e reforma urbana: Comunicação foi publicada no The Lancet Global Health, uma das mais antigas e conhecidas revistas médicas do mundo","Jornal da USP","http://jornal.usp.br/ciencias/ciencias-da-saude/pesquisador-da-usp-publica-no-the-lancet-global-health-sobre-a-relacao-entre-zika-mega-eventos-e-reforma-urbana/","Ciências da Saúde"
"2016-09-02","Deficiência em hormônio promove ganho de peso em pacientes após cirurgia bariátrica: A pesquisa avaliou 24 pacientes submetidos à cirurgia bariátrica, acompanhados pelo período de cinco anos","Jornal da USP","http://jornal.usp.br/ciencias/ciencias-da-saude/deficiencia-em-hormonio-promove-ganho-de-peso-em-pacientes-apos-cirurgia-bariatrica/","Ciências da Saúde, Cirurgia bariátrica, Faculdade de Medicina, HC, Hormônio gastrointestinal GLP-1, Marco Aurélio Santo, Obesidade"
"2016-09-02","Larvas de moscas em cadáveres podem ajudar peritos a esclarecer casos de morte: Análise de insetos fornece informações que podem auxiliar na determinação do local e das causas da morte","Jornal da USP","http://jornal.usp.br/ciencias/ciencias-biologicas/larvas-de-moscas-em-cadaveres-podem-ajudar-peritos-a-esclarecer-casos-de-morte/","Ciências Biológicas, Entomologia, FMUSP, medicina legal, São Paulo"
"2016-09-01","Estamos perto de encontrar vida em outros planetas, afirma astrônomo: Cientistas discutiram no último USP Talks as origens da vida e do universo. Augusto Damineli e João Steiner falaram sobre o Telescópio Gigante Magalhães, um grande passo para conseguir verificar a presença de vida em outros planetas","Jornal da USP","http://jornal.usp.br/universidade/estamos-perto-de-encontrar-vida-em-outros-planetas-afirma-astronomo/","Ciências Exatas e da Terra, Universidade, Astrofísica, Astronomia, Energia Escura, Matéria escura, Telescópio Gigante Magalhães, Universo, USP Talks, Vida extraterrestre"
"2016-09-01","Perfil da ovinocultura leiteira no Brasil revela: vale a pena investir neste mercado: Pesquisadora realizou levantamento da produção agroindustrial da ovinocultura, incluindo os derivados lácteos","Jornal da USP","http://jornal.usp.br/ciencias/ciencias-agrarias/perfil-da-ovinocultura-leiteira-no-brasil-revela-vale-a-pena-investir/","Ciências Agrárias, Augusto Hauber Gameir, Fernanda Ferreira Santos, FMVZ, Iogurte de ovelha, LAE, Leite de Ovelha, Ovelhas, Ovinocultura, Ovinos, Queijo de ovelha"
"2016-09-01","Fermentado de soja estimula a produção de colágeno e melhora elasticidade da pele: Gel à base de extrato de soja biotransformada é capaz de estimular produção de colágeno. Produto foi desenvolvido em laboratórios da Faculdade de Ciências Farmacêuticas de Ribeirão Preto","Jornal da USP","http://jornal.usp.br/ciencias/ciencias-da-saude/fermentado-de-soja-estimula-a-producao-de-colageno-e-melhora-elasticidade-da-pele/","Ciências da Saúde, colágeno, dermocosmético, envelhecimento da pele, extrato biotransformado de soja, extrato de soja, FCFRP, fibroplastos primários"
"2016-08-31","Pesquisadores da USP em Ribeirão criam material alternativo para garantir qualidade na radioterapia: Pesquisadores do Departamento de Física criam material alternativo para garantir qualidade nos tratamentos de radioterapia. O trabalho foi  premiado em evento em Munique, Alemanha","Jornal da USP","http://jornal.usp.br/ciencias/pesquisadores-da-usp-em-ribeirao-criam-material-alternativo-para-garantir-qualidade-na-radioterapia/","Ciências, “antenas de luz”., 18ª Conferência Internacional de Dosimetria do Estado Sólido SSD18, Departamento de Física, dosimetria, dosímetro pequeno, FFCLRP, luz, material alternativo, nanopartículas de Prata, Nanotecnologia, OSL, pesquisa, Prêmio de Jovem Cientista, programa de Física Aplicada à Medicina e Biologia, radioterapia, sensibilidade aumentada, USP"
"2016-08-31","Estudo indica que camu-camu e cupuaçu podem ajudar no controle da obesidade e da diabete: Pesquisa com frutas amazônicas busca formas inovadoras capazes de reduzir as alterações metabólicas associadas à diabete tipo 2 e à obesidade","Jornal da USP","http://jornal.usp.br/ciencias/ciencias-da-saude/estudo-indica-que-camu-camu-e-cupuacu-podem-ajudar-no-controle-da-obesidade-e-da-diabetes/","Ciências da Saúde, Amazônia, Camu Camu, Cupauçu, Diabetes, Faculdade de Ciências Farmacêuticas, FCF, Frutas, Helena Rudge de Moraes Barros, Maria Inês Genovese Rodriguez, Nutrição, Obesidade, Saúde"
"2016-08-31","Cientistas descrevem fóssil de lagarto que viveu há cerca de 23 milhões de anos: Descrição de fóssil encontrado na região da Patagônia argentina traz conhecimentos que poderão ajudar em estudos sobre as mudanças climáticas e sua relação com as espécies de animais similares","Jornal da USP","http://jornal.usp.br/ciencias/ciencias-exatas-e-da-terra/cientistas-descrevem-fossil-de-lagarto-que-viveu-ha-cerca-de-23-milhoes-de-anos/","Ciências Biológicas, Ciências Exatas e da Terra, Callopistes, fóssil, lagarto, Museu de Zoologia, Teiidae"
"2016-08-31","Sistema permite trabalho colaborativo entre portadores de deficiência visual e pessoas com visão normal: Sistema que converte gráficos de computador em áudio integra pesquisa sobre recursos computacionais para inclusão em cursos e no mercado de trabalho","Jornal da USP","http://jornal.usp.br/ciencias/tecnologia/sistema-permite-trabalho-colaborativo-entre-portadores-de-deficiencia-visual-e-pessoas-com-visao-normal/","Tecnologia, deficiência, inclusão, Poli, portadores de deficiência visual, recursos computacionais, São Paulo"
"2016-08-31","Gelatina substitui gordura vegetal e aumenta teor de proteínas em pasta de chocolate: Feita com pés de frango, gelatina diminui quantidade de gordura na pasta de chocolate e reduz custo de produção em 53%","Jornal da USP","http://jornal.usp.br/ciencias/ciencias-da-saude/gelatina-substitui-gordura-vegetal-e-aumenta-teor-de-proteinas-em-pasta-de-chocolate/","Ciências da Saúde, chocolate, Faculdade de Ciências Farmacêuticas, FCF, gelatina, Nutrição, São Paulo"
"2016-08-31","Filósofo Francis Wolff faz conferência sobre o conceito de amizade: Evento faz parte da abertura do Ciclo Mutações 2016, que será realizado até 4 de novembro, em São Paulo, com participação de professores da USP","Jornal da USP","http://jornal.usp.br/ciencias/filosofo-francis-wolff-faz-conferencia-sobre-o-conceito-de-amizade/","Ciências, Adauto Novaes, Ciclo Mutações, Mário Sant, Rádio USP"
"2016-08-30","Terapia fotodinâmica é eficiente na prevenção de câncer de colo uterino: Projeto desenvolvido pelo grupo de Óptica do Instituto de Física de São Carlos foi vencedor da categoria ""Integração"" do Prêmio Mercosul de Ciência e Tecnologia","Jornal da USP","http://jornal.usp.br/ciencias/tecnologia/terapia-fotodinamica-e-eficiente-na-prevencao-de-cancer-de-colo-uterino/","Tecnologia, Câncer, Câncer de colo de útero, Grupo de Óptica, IFSC, prevenção, São Carlos, terapia fotodinâmica"
"2016-08-30","Normas de qualidade das lentes de óculos escuros precisam ser revistas: A exposição ao sol deteriora os óculos com o passar do tempo, e as lentes podem se tornar mais claras, alterando a categoria em que estão classificadas","Jornal da USP","http://jornal.usp.br/ciencias/ciencias-biologicas/normas-de-qualidade-das-lentes-de-oculos-escuros-precisam-ser-revistas/","Ciências Biológicas, EESC, Escola de Engenharia de São Carlos, Laboratório de Instrumentação Oftálmica, Lentes, Liliane Ventura, Óculos escuro, Raios UVB"
"2016-08-30","USP recebe evento internacional de moda e negócios: A Fashion Connection contará com a apresentação de grandes artistas plásticos e designers de moda de países como Portugal, Angola e Brasil","Jornal da USP","http://jornal.usp.br/ciencias/usp-recebe-evento-internacional-de-moda-e-negocios/","Ciências, Design, EACH, Fashion Connection, Moda"
"2016-08-29","Nuvem computacional da USP é aberta à comunidade científica: Sistema interNuvem poderá ser usado por pesquisadores vinculados a outras universidades e instituições de pesquisa","Jornal da USP","http://jornal.usp.br/ciencias/nuvem-computacional-da-usp-e-aberta-a-comunidade-cientifica/","Ciências, cloud computing, Fapesp, interNuvem USP, nuvem computacional"
"2016-08-29","Clínica do Leite lança mapa da qualidade do produto na Região Sudeste: Laboratório monitora cerca de 30% do leite produzido no Brasil; diagnóstico aponta necessidade de melhora no controle da mastite","Jornal da USP","http://jornal.usp.br/ciencias/ciencias-agrarias/clinica-do-leite-lanca-mapa-da-qualidade-do-leite-da-regiao-sudeste/","Ciências Agrárias, Clínica do Leite, Esalq, pecuária leiteira, Piracicaba"
"2016-08-29","Lançada nova edição do “Journal of Applied Oral Science”: Revista editada pela Faculdade de Odontologia de Bauru traz artigos em inglês sobre avanços científicos e tecnológicos da área odontológica","Jornal da USP","http://jornal.usp.br/ciencias/ciencias-da-saude/lancada-nova-edicao-do-journal-of-applied-oral-science/","Ciências da Saúde, Bauru, culdade de Odontologia de Bauru, FOB, Journal of Applied Oral Science, Odontologia"
"2016-08-29","Fragilidade física, psicológica e social aumenta risco de morte em idosos: Estudo da EERP mostra que quanto maior a fragilidade nos idosos, maior o risco de morte","Jornal da USP","http://jornal.usp.br/ciencias/ciencias-da-saude/fragilidade-aumenta-risco-de-morte-em-idosos/","Ciências da Saúde, EERP, escolaridade, fragilidade, Idosos, mortalidade, pesquisa, Saúde, USP"
"2016-08-26","Indústria 4.0: internet das coisas agiliza exportação nos portos brasileiros: Sistema será apresentado no evento Strategic Workshops, promovido pela Pró-Reitoria de Pesquisa, que contará com a abertura de Marcos Pereira, ministro da Indústria, Comércio Exterior e Serviços","Jornal da USP","http://jornal.usp.br/ciencias/ciencias-exatas-e-da-terra/industria-4-0-internet-das-coisas-agiliza-exportacao-nos-portos-brasileiros/","Ciências Exatas e da Terra, Canal Azul, Chip de rastreamento de carne bovina, Exportação, Poli, PRP, Strategic Workshop"
"2016-08-25","Técnicas que imitam sistema nervoso humano aceleram aprendizado de máquinas: Aplicações das técnicas incluem jogos eletrônicos, robôs, sistemas de recomendação na web e carros autônomos","Jornal da USP","http://jornal.usp.br/ciencias/ciencias-exatas-e-da-terra/google-premia-tecnicas-que-imitam-sistema-nervoso-humano-para-acelerar-aprendizado-de-maquinas/","Ciências Exatas e da Terra, aprendizado de máquinas, Poli, São Paulo, transferência do aprendizado"
"2016-08-25","Vídeo mostra curiosidades sobre vilão da saúde pública, o Aedes aegypti: Na mira dos órgãos nacionais e internacionais de saúde, mosquito Aedes aegypti tem perfil e hábitos já bastante familiares aos pesquisadores","Jornal da USP","http://jornal.usp.br/tv-usp/video-mostra-curiosidades-sobre-vilao-da-saude-publica-o-aedes-aegypti/","Ciências Biológicas, TV USP, Aedes aegypti, Anderson de Sá Nunes, Chikungunya, Dengue, ICB, Instituto de Ciências Biomédicas, Mosquito"
"2016-08-25","Sistema desenvolvido na Poli aprimora análise de risco de investimento em energia renovável: Modelo pode ser usado por empresas que geram, comercializam ou consomem energia, especialmente aquelas que operam no chamado mercado livre","Jornal da USP","http://jornal.usp.br/ciencias/ciencias-exatas-e-da-terra/sistema-desenvolvido-na-poli-aprimora-analise-risco-de-investimento-em-energia-renovavel/","Ciências Ambientais, Ciências Exatas e da Terra, Análise de Risco, Energia eólica, Energia Renovável, Escola Politécnica, Investimento, Poli"
"2016-08-24","Bebê nascido com zika teve vírus detectado até os dois meses de vida: O caso acompanhado por pesquisadores da USP e da Santa Casa de São Paulo é publicado pela revista “New England Journal of Medicine” nesta quarta-feira, 24","Jornal da USP","http://jornal.usp.br/ciencias/ciencias-da-saude/bebe-nascido-com-zika-teve-virus-detectado-ate-os-dois-meses-de-vida/","Ciências da Saúde, FMUSP, ICB, Instituto de Ciências Biomédicas, Microcefalia, Zika, Zika Vírus"
"2016-08-24","Canal de vídeos apresenta noções da psicologia anomalística: Aspectos cognitivos, experiências fora do corpo e experiências anômalas são alguns dos temas dos vídeos do canal Inter-Psi USP","Jornal da USP","http://jornal.usp.br/ciencias/canal-de-videos-apresenta-nocoes-da-psicologia-anomalistica/","Ciências, Universidade, Divulgação científica, Instituto de Psicologia, Inter-Psi"
"2016-08-24","USP recebe maratona de edição sobre verbetes relacionados a Neurociência e Matemática: A ""editatona"" acontece no Laboratório de Computação do NeuroMat, no prédio do Numec do Instituto de Matemática e Estatística (IME) da USP","Jornal da USP","http://jornal.usp.br/ciencias/usp-recebe-maratona-de-edicao-sobre-verbetes-relacionados-a-neurociencia-e-matematica/","Ciências, Tecnologia, Centro de Pesquisa Inovação e Difusão em Neuromatemática, Editatona, Grupo de Usuários Wikipédia no Brasil, IME, Maratona de Edição na Wikipédia sobre Neurociência e Matemática, NeuroMat, Wikimedia"
"2016-08-23","Estudo sobre assédio moral no trabalho está em nova edição da revista “Saúde, Ética & Justiça”: Periódico divulga pesquisas nas áreas de medicina legal, direito e ética relacionada à saúde","Jornal da USP","http://jornal.usp.br/ciencias/ciencias-humanas/estudo-sobre-assedio-moral-no-trabalho-esta-em-nova-edicao-da-revista-saude-etica-justica/","Ciências da Saúde, Ciências Humanas, Assedio Moral no Trabalho, Faculdade de Medicina, FMUSP, Instituto Oscar Freire FMUSP, Publicação, Revista Saúde Ética & Justiça"
"2016-08-23","Livro apresenta a matemática como ferramenta de promoção da inclusão: De autoria da pesquisadora Renata Meneghetti, livro apresenta subsídios teóricos e práticos, relatando atividades de ensino e aprendizagem de matemática em empreendimentos de economia solidária","Jornal da USP","http://jornal.usp.br/ciencias/ciencias-exatas-e-da-terra/ciencias-2308-matematica-como-ferramenta-de-promocao-e-tema-abordado-em-livro/","Ciências Exatas e da Terra, Economia Solidária, ICMC, Inclusão social, Lançamento de livro, Matemática"
"2016-08-23","Físico explica por que ação humana é decisiva na atual era geológica, o Antropoceno: O físico Paulo Artaxo vai  discutir a época geológica atual e as tarefas que serão exigidas da ciência","Jornal da USP","http://jornal.usp.br/ciencias/palestra-do-professor-paulo-artaxo-explica-o-antropoceno/","Atualidades, Ciências, Rádio USP, Antropoceno, Clima global, Época Geológica, Paulo Artaxo"
"2016-08-23","Videoaulas da USP levam conceitos da física para o público: Vídeos contemplam explicações de termodinâmica a física quântica com aulas teóricas, exercícios e experimentos","Jornal da USP","http://jornal.usp.br/universidade/videoaulas-da-usp-levam-conceitos-da-fisica-para-o-publico/","Ciências Exatas e da Terra, Rádio USP, Universidade, Aulas de física, Educação científica, Física Universitária, Gil da Costa Marques"
"2016-08-23","Legado da Olimpíada pode fazer Rio dar primeiros passos para ser uma “cidade inteligente”: Infraestrutura tecnológica instalada para a Rio 2016 pode transformar a capital carioca numa ""cidade inteligente""","Jornal da USP","http://jornal.usp.br/ciencias/tecnologia/legado-da-olimpiada-faz-rio-dar-primeiros-passos-para-ser-uma-cidade-inteligente/","Tecnologia, Jogos Olímpicos Rio 2016, LASSU, legado, olimpíada, Poli, Rio 2016, tecnologia"
"2016-08-22","Discurso proibitivo sobre o uso drogas e álcool é tema de revista da Enfermagem: A Escola de Enfermagem de Ribeirão Preto lançou uma nova edição de sua revista abordando o discurso proibicionista no campo das drogas","Jornal da USP","http://jornal.usp.br/ciencias/ciencias-humanas/discurso-proibitivo-sobre-o-uso-drogas-e-alcool-e-tema-de-revista-da-enfermagem/","Ciências da Saúde, Ciências Humanas, álcool, Drogas, EERP, Escola de Enfermagem de Ribeirão Preto, Periódico, Revista Eletrônica Saúde Mental Álcool e Drogas, saúde mental"
