" 26 de novembro de 2015.","Termodinâmica na prática: construindo conceitos","Contextualização e laboratório didático no ensino médio: as contribuições do trabalho prático no ensino de física.","Canal Ciencia - IBICT","http://www.canalciencia.ibict.br/pesquisa/0293_Termodinamica_na_pratica.html",""
"03 de dezembro de 2003.","Teste respiratório ajuda no diagnóstico e tratamento do transtorno de pânico","Transtorno de Pânico & Respiração","Canal Ciencia - IBICT","http://www.canalciencia.ibict.br/pesquisa/0182-Teste-respiratorio-diagnostico-tratamento-transtorno-panico.html",""
"16 de março de 2004.","Tolerância de dourados e jundiás em níveis de amônia e oxigênio dissolvidos na água: aprimorando as criações em tanques","Aprimoramento da criação de jundiá, Rhamdia quelen, e dourado, Salminus brasiliensis","Canal Ciencia - IBICT","http://www.canalciencia.ibict.br/pesquisa/0206-Dourados-jundias-niveis-de-amonia-e-oxigenio-agua.html",""
"14 de outubro de 2013 ","Trem Luziânia-Brasília: Uma proposta de integração e desenvolvimento regional","","Canal Ciencia - IBICT","http://www.canalciencia.ibict.br/pesquisa/0255-Trem-luziania-brasilia-uma-proposta-de-integracao-regional.html",""
"05 de agosto de 2009.","Técnicas de mineração de dados para extração de informações promovem o desenvolvimento sustentável das Aldeias Indígenas de Xucuru","Mineração de Dados no auxílio às Comunidades das Aldeias Indígenas de Xucuru.","Canal Ciencia - IBICT","http://www.canalciencia.ibict.br/pesquisa/0235-Mineracao-de-dados-e-desenvolvimento-sustentavel-de-aldeias-indigenas.html",""
"24 de abril de 2006.","Técnicas de mineração de dados são utilizadas para a previsão de escorregamentos das encostas","Predição de Escorregamentos das Encostas do Município do Rio de Janeiro através de Técnicas de Mineração de Dados","Canal Ciencia - IBICT","http://www.canalciencia.ibict.br/pesquisa/0224-Mineracao-de-dados-para-previsao-escorregamentos-encostas.html",""
"09 de dezembro de 2002.","Uacari-branco, o mais misterioso macaco da Amazônia","Biologia e ecologia comportamental dos uacaris-brancos nas matas de várzea de Mamirauá","Canal Ciencia - IBICT","http://www.canalciencia.ibict.br/pesquisa/0054-Biologia-ecologia-comportamental-macaco-uacari-amazonia.html",""
"23 de agosto de 2005.","Uso da bioinformática para estudo de vacina contra a esquistossomose","Seleção de antígenos de membrana candidatos a compor uma vacina antiesquistossomótica utilizando análises genômicas do transcriptoma do Schistosoma mansoni e avaliação da imunogenecidade e proteção gerada por estes antígenos.","Canal Ciencia - IBICT","http://www.canalciencia.ibict.br/pesquisa/0216-Bioinformatica-vacina-esquistossomose.html",""
"09 de julho de 2013","Uso da espectroscopia Raman na avaliação de células de câncer de mama","Uso da técnica SERS para distinção entre células sadias e de câncer de mama e para avaliação dessas células após Terapia Fotodinâmica: um estudo in vitro.","Canal Ciencia - IBICT","http://www.canalciencia.ibict.br/pesquisa/0252-A-espectroscopia-Raman-na-avaliacao-em-celulas-de-cancer-de-mama.html",""
"04 de dezembro de 2003.","Uso de fungos no desenvolvimento de novas terapias para a cura das micoses mais comuns no Brasil","Infecções fúngicas de alta incidência no estado do Rio de Janeiro: Caracterização funcional e bioquímica de componentes de superfície associados à patogenicidade","Canal Ciencia - IBICT","http://www.canalciencia.ibict.br/pesquisa/0184-Uso-fungos-terapias-contra-micoses.html",""
"29 de novembro de 2002.","Uso de resíduos madeireiros na economia e ecologia amazônicas","Avaliação do potencial de utilização de resíduos madeireiros e produtos descartáveis derivados da madeira na região amazônica.","Canal Ciencia - IBICT","http://www.canalciencia.ibict.br/pesquisa/0004-Utilizacao-residuos-madeireiros-na-amazonia.html",""
"02 de março de 2015.","Uso do metrô e a sustentabilidade: investindo na qualidade de vida das cidades","Valoração dos benefícios do Metrô para a Saúde Pública com a redução da poluição do ar em São Paulo","Canal Ciencia - IBICT","http://www.canalciencia.ibict.br/pesquisa/0275_Uso_do_metro_saude_humana.html",""
"14 de abril de 2015.","Uso sustentável da biodiversidade de plantas: benefícios para a saúde humana","Uso sustentável da biodiversidade de áreas remanescentes da Mata Atlântica do Estado de São Paulo - avaliação, isolamento e caracterização molecular de metabólitos secundários bioativos em espécies vegetais","Canal Ciencia - IBICT","http://www.canalciencia.ibict.br/pesquisa/0277_Uso_sustentavel_de_plantas_saude_humana.html",""
"19 de outubro de 2011","Vacinação de lobos-guarás contra cinomose e parvovirose caninas","Avaliação pós-vacinal de lobos-guarás Chrysocyon brachyurus (Illiger, 1811) para os vírus da cinomose e parvovirose caninas","Canal Ciencia - IBICT","http://www.canalciencia.ibict.br/pesquisa/0243-Vacinacao-de-lobos-guaras.html",""
"11 de dezembro de 2002.","Valor nutritivo de alimentos amazônicos: açaí, camu-camu, cubiu e pupunha","Potencial dos alimentos da região amazônica e impacto quanto à utilização","Canal Ciencia - IBICT","http://www.canalciencia.ibict.br/pesquisa/0077-Valor-nutritivo-alimentos-amazonicos.html",""
