"10 de dezembro de 2002.","Manejo de peixes ornamentais e quelônios no Rio Negro","Projeto Mariuá – bases ecológicas, tecnológicas e sócio-econômicas para o manejo sustentável de peixes ornamentais e quelônios na bacia do Rio Negro(AM)","Canal Ciencia - IBICT","http://www.canalciencia.ibict.br/pesquisa/0065-Manejo-de-peixes-ornamentais-e-quelonios-no-Rio-Negro.html",""
"14 de setembro de 2011.","Manejo e conservação do tracajá no Parque Indígena do Xingu","Educação Ambiental e manejo sustentável de tracajá Podocnemis unifilis: Segurança alimentar e fortalecimento cultural dos povos do Parque Indígena do Xingu.","Canal Ciencia - IBICT","http://www.canalciencia.ibict.br/pesquisa/0242-Manejo-conservacao-do-tracaja-no-Parque-Indigena-Xingu.html",""
"01 de dezembro de 2002.","Manejo, reprodução e criação de peixes amazônicos","Estudos sobre manejo, reprodução e criação de pirarucu, matrinxã e tambaqui em cativeiro. ","Canal Ciencia - IBICT","http://www.canalciencia.ibict.br/pesquisa/0008-Manejo-reproducao-criacao-de-peixes-amazonicos.html",""
"10 de junho de 2014.","Medicamentos feitos a partir da castanha de caju auxiliam no tratamento de Alzheimer","Modelagem molecular de potenciais candidatos a inibidores da acetilcolinesterase.","Canal Ciencia - IBICT","http://www.canalciencia.ibict.br/pesquisa/0265-Medicamentos-feitos-do-caju-auxiliam-no-tratamento-de-Alzheimer.html",""
"09 de setembro de 2003.","Melhoramento genético da pupunha, palmito amazônico de grande potencial econômico","Melhoramento genético da pupunheira: conhecimentos atuais e necessidades","Canal Ciencia - IBICT","http://www.canalciencia.ibict.br/pesquisa/0150-Melhoramento-genetico-da-pupunha.html",""
"02 de dezembro de 2002.","Modelo comunitário de exploração sustentável de madeira pode salvar florestas na Amazônia","O desafio de conservar as florestas inundáveis amazônicas no Brasil","Canal Ciencia - IBICT","http://www.canalciencia.ibict.br/pesquisa/0010-Modelo-comunitario-exploracao-sustentavel-de-madeira-amazonia.html",""
"31 de março de 2016.","Mortalidade de corais revela a saúde dos oceanos","Branqueamento de corais nos recifes do Pecém (NE, Brasil) e sua relação com as mudanças ambientais.","Canal Ciencia - IBICT","http://www.canalciencia.ibict.br/pesquisa/0290_Mortalidade_de_corais_revela_saude_dos_oceanos",""
"11 de dezembro de 2002.","Moscas indicam que sistemas agrícolas ameaçam biodiversidade","Moscas como bioindicador para perda de biodiversidade em sistemas agrícolas","Canal Ciencia - IBICT","http://www.canalciencia.ibict.br/pesquisa/0074-Moscas-indicadoras-de-perda-de-biodiversidade.html",""
"07 de dezembro de 2002.","Máscaras Ticuna sacralizam a interação nativa com a floresta","As máscaras Ticuna em uma perspectiva histórico-comparativa","Canal Ciencia - IBICT","http://www.canalciencia.ibict.br/pesquisa/0051-Mascaras-e-Ticuna-e-a-interacao-com-a-floresta.html",""
"08 de julho de 2013","Músculos artificiais de nanotubos de carbono","Electrically, chemically, and photonically Powered Torsional and Tensile Actuation of Hybrid Carbon Nanotube Yarn Muscles (Atuação rotacional e linear de músculos de fibra híbrida de nanotubos de carbono acionada eletricamente, quimicamente e fotonicamente)","Canal Ciencia - IBICT","http://www.canalciencia.ibict.br/pesquisa/0251-Musculos-artificiais-de-nanotubos-de-carbono.html",""
"15 de junho de 2016.","Nanossensores medem a poluição do ar com mais eficiência","Desenvolvimento de nanossensores para detecção de gases poluentes emitidos no Distrito Federal","Canal Ciencia - IBICT","http://www.canalciencia.ibict.br/pesquisa/0306_nanossensores_medem_a_poluicao_do_ar_com_maior_eficiencia.html",""
"21 de junho de 2016.","Nanotecnologia em próteses dentárias de titânio","Internalização de nanopartículas de dióxido de titânio (anatase) por células ósseas humanas: efeito Cavalo de Tróia","Canal Ciencia - IBICT","http://www.canalciencia.ibict.br/pesquisa/0307_Nanotecnologia_em_proteses_dentarias_de_titanio.html",""
"04 de março de 2004.","Normas tributárias para preservar as florestas de Araucária do Paraná","Instrumentos Jurídicos para a gestão das Florestas de Araucárias no Estado do Paraná","Canal Ciencia - IBICT","http://www.canalciencia.ibict.br/pesquisa/0204-Normas-tributarias-para-preservacao-das-florestas-de-Araucaria-do-Parana.html",""
"01 de dezembro de 2002.","Nova teoria da pré-história amazônica valoriza culturas ancestrais","A Gênese das Sociedades Amazônicas e a Preservação do Patrimônio Arqueológico  ","Canal Ciencia - IBICT","http://www.canalciencia.ibict.br/pesquisa/0006-Teoria-da-pre-historia-valoriza-culturas-ancestrais-na-amazonia.html",""
"23 de março de 2016.","Nova terapia para esclerose lateral amiotrófica (ELA)","Avaliação dos mecanismos de atraso da progressão da Esclerose Lateral Amiotrófica (ELA) pela ingestão de trealose e/ou vitamina E em Caenorhabditis Elegans","Canal Ciencia - IBICT","http://www.canalciencia.ibict.br/pesquisa/0297_Nova_terapia_para_esclerose_lateral_amiotrofica.html",""
"10 de março de 2015.","Nova vacina capaz de controlar o avanço da doença de Chagas","Vacina terapêutica para Trypanosoma cruzi, construída em vetor adenovírus humano do tipo 5, reprograma a resposta imune e reverte e cardiomiopatia chagásica crônica.","Canal Ciencia - IBICT","http://www.canalciencia.ibict.br/pesquisa/0276_Vacina_pode_controlar_avancos_da_Doenca_de_Chagas.html",""
"15 de setembro de 2016.","Novo modelo de cadeira de rodas para uso residencial","Desenvolvimento de cadeira de rodas residencial","Canal Ciencia - IBICT","http://www.canalciencia.ibict.br/pesquisa/0308_Novo_modelo_cadeira_de_rodas_para_uso_residencial",""
"11 de dezembro de 2002.","Novos remédios a partir de plantas e de microrganismos da Amazônia","Recursos naturais amazônicos como fonte de princípios bioativos aplicáveis na terapêutica das principais endemias infecciosas da Amazônia.","Canal Ciencia - IBICT","http://www.canalciencia.ibict.br/pesquisa/0076-Remedios-derivados-de-plantas-microrganismos-da-Amazonia.html",""
"25 de setembro de 2013.","O brasileiro e o direito do consumidor","O brasileiro e o direito do consumidor","Canal Ciencia - IBICT","http://www.canalciencia.ibict.br/pesquisa/0253-Brasileiro-e-o-direito-do-consumidor.html",""
"28 de maio de 2003.","O Projeto LBA - Experimento de Larga Escala na Biosfera-Atmosfera na Amazônia","LBA, Experimento de Larga Escala da Biosfera-Atmosfera na Amazônia (ou, em inglês, Large-scale Biosphere-Atmosphere Experiment in Amazonia)","Canal Ciencia - IBICT","http://www.canalciencia.ibict.br/pesquisa/0117-Projeto-LBA.html",""
"6 de maio de 2014","O que acontece no cérebro quando divagamos?","Dissociação funcional dos componentes ventral-frontal e dorso-medial da rede de modo padrão durante repouso e recordação de memórias autobiográficas emocionais.","Canal Ciencia - IBICT","http://www.canalciencia.ibict.br/pesquisa/0263-Atividade-cerebral-durante-divagacao-mental.html",""
"sem data","O trabalho de crianças e jovens na extração do coco babaçu","Espaço de Atuação da OIT: o trabalho de crianças e jovens na cadeia produtiva do coco babaçu","Canal Ciencia - IBICT","http://www.canalciencia.ibict.br/pesquisa/0258-O-trabalho-de-crianca-e-jovens-na-extracao-do-coco-babacu.html",""
"17 de outubro de 2016.","Os benefícios do suco de uva para a vida do idoso","Influência do consumo crônico de suco de uva sobre o equilíbrio, parâmetros bioquímicos, de estresse oxidativo e de danos ao DNA em idosos hígidos","Canal Ciencia - IBICT","http://www.canalciencia.ibict.br/pesquisa/0312_Os_beneficios_suco_uva_para_vida_do_idoso",""
"09 de junho de 2016.","Os calangos-de-colar da América do Sul","Systematic revision of the lizards of the subfamily Tropidurinae (Tropiduridae), with special reference to Tropidurus Wied, 1825","Canal Ciencia - IBICT","http://www.canalciencia.ibict.br/pesquisa/0305_Os_calangos-de-colar_da_America_do_Sul.html",""
"10 de outubro de 2003.","Pesquisa brasileira busca novo processo para a síntese do éter metílico, combustível alternativo aos derivados de petróleo","Rotas não tradicionais de geração de insumos petroquímicos e combustíveis a partir do gás natural – GTL 2. Geração de dimetiléter por síntese direta em escala de bancada e geração de dados para um projeto de planta piloto","Canal Ciencia - IBICT","http://www.canalciencia.ibict.br/pesquisa/0160-Novo-processo-de-sintese-do-combustivel-eter-metilico.html",""
"26 de outubro de 2003.","Pesquisa brasileira cria tecnologia própria para equipamento estratégico: o sensor magnético de alta resolução","Desenvolvimento de Instrumentação Geomagnética","Canal Ciencia - IBICT","http://www.canalciencia.ibict.br/pesquisa/0163-Equipamento-estrategico-sensor-magnetico-alta-resolucao.html",""
"28 de maio de 2003.","Pesquisa busca provas da sobrevivência indígena no interior do Rio Grande do Norte","Vivências Índias, Mundos Mestiços: relações interétnicas na Freguesia da Gloriosa Senhora Santa Ana do Seridó entre o final do século XVIII e início do século XIX","Canal Ciencia - IBICT","http://www.canalciencia.ibict.br/pesquisa/0116-Sobrevivencia-indigena-no-interior-do-Rio-Grande-do-Norte.html",""
"14 de agosto de 2003.","Pesquisa compara métodos de medição de doses irradiadas em exames de tomografia computadorizada para facilitar rotinas de prevenção","Estudo comparativo das doses efetivas em exames de tomografia computadorizada de cabeça e abdome","Canal Ciencia - IBICT","http://www.canalciencia.ibict.br/pesquisa/0142-Medicao-de-rdiacao-em-exames-de-tomografia.html",""
"03 de dezembro de 2003.","Pesquisa compara o efeito da exploração madeireira convencional com métodos de redução do impacto na regeneração de árvores","Efeito da exploração madeireira convencional e de impacto reduzido sobre a regeneração de três espécies arbóreas na Amazônia brasileira","Canal Ciencia - IBICT","http://www.canalciencia.ibict.br/pesquisa/0176-Efeito-da-exploracao-madeireira-convencional.html",""
"25 de julho de 2003.","Pesquisa de métodos não invasivos para mapear regiões do cérebro pode ser usada em cirurgias de pacientes com epilepsia","Mapeamento Pré-Cirúrgico em Pacientes Indicados à Cirurgia de Epilepsia","Canal Ciencia - IBICT","http://www.canalciencia.ibict.br/pesquisa/0134-Mapeamento-do-cerebro-em-pacientes-com-epilepsia.html",""
"19 de fevereiro de 2004.","Pesquisa demonstra como anúncios de televisão difundem maus hábitos alimentares","Quantidade e qualidade de produtos alimentícios anunciados na televisão brasileira","Canal Ciencia - IBICT","http://www.canalciencia.ibict.br/pesquisa/0199-Anuncios-televisao-maus-habitos-alimentares1.html",""
"26 de outubro de 2003.","Pesquisa desenvolve método mais rápido para testar o ponto focal de tubos de Raios X com precisão","Metodologia de Determinação das Dimensões de Ponto Focal de Tubos de Raios X Médicos - Exemplo de uma Aplicação Prática","Canal Ciencia - IBICT","http://www.canalciencia.ibict.br/pesquisa/0164-Dimensao-do-ponto-focal-dos-tubos-de-Raios-X.html",""
"22 de agosto de 2003.","Pesquisa estuda a redução de dose efetiva de radiação em pacientes e o aumento da vida útil do tubo de Raios X nos equipamento de Tomografia Computadorizada","Redução de Dose e Aumento na Vida Útil do Tubo de Raios X em Tomografia Computadorizada","Canal Ciencia - IBICT","http://www.canalciencia.ibict.br/pesquisa/0145-Reducao-dose-radiacao-e-aumento-vida-util-tubo-Raios-X-de-tomografos.html",""
"12 de junho de 2003.","Pesquisa estuda características de recuperação de solo em áreas amazônicas afetadas por exploração de minérios","Vegetação e características do solo como indicadores de reabilitação de áreas mineradas na Amazônia Oriental","Canal Ciencia - IBICT","http://www.canalciencia.ibict.br/pesquisa/0119-Recuperacao-do-solo-em-areas-de-mineracao-na-amazonia.html",""
"03 de dezembro de 2003.","Pesquisa estuda como as migrações internas afetaram localidades urbanas brasileiras no período de 1980 a 2000","Migração e urbanização descentralizada no Brasil contemporâneo","Canal Ciencia - IBICT","http://www.canalciencia.ibict.br/pesquisa/0178-Pactos-das-migracoes-internas.html",""
"14 de agosto de 2003.","Pesquisa estuda mudanças em comunidades de animais marinhos incrustantes próximas às usinas nucleares de Angra I e II","Efeito do efluente da Usina Nuclear de Angra dos Reis: utilização de comunidades incrustantes como bioindicadores","Canal Ciencia - IBICT","http://www.canalciencia.ibict.br/pesquisa/0141-Comunidades-marinhos-incrustantes-em-usinas-nucleares.html",""
"25 de julho de 2003.","Pesquisa estuda uso de Imagens por Ressonância Magnética para determinar o excesso de ferro nos tecidos","Avaliação do nível de ferro hepático através da relaxometria em imagens por ressonância magnética","Canal Ciencia - IBICT","http://www.canalciencia.ibict.br/pesquisa/0137-Indeterminacao-de-ferro-nos-tecidos-ressonancia-magnetica.html",""
"09 de dezembro de 2002.","Pesquisa revela: cultivo do dendê em pequena escala preserva ecossistema florestal","Caracterização dos ecossistemas florestais e de áreas manejadas com cultivo de dendê","Canal Ciencia - IBICT","http://www.canalciencia.ibict.br/pesquisa/0060-Cultivo-dende-ecossistema-florestal-amazonia.html",""
"04 de março de 2004.","Pesquisa sobre comportamento, área de distribuição e genética do Rato-da-Taquara ajuda a preservar a espécie","Ecologia, distribuição e variação genética do Rato-da-Taquara (Kannabateomys amblyonyx) no Rio Grande do Sul","Canal Ciencia - IBICT","http://www.canalciencia.ibict.br/pesquisa/0203-Comportamento-area-distribuicao-e-genetica-do-rato-da-taquara.html",""
"10 de outubro de 2003.","Pesquisa testa equipamentos de radiografia industrial em uso no Brasil e revela situação de risco para operadores","Avaliação das Condições de Segurança Radiológica de Irradiadores Portáteis Panorâmicos de Gamagrafia Industrial Utilizados no Brasil","Canal Ciencia - IBICT","http://www.canalciencia.ibict.br/pesquisa/0161-Radiografia-industrial-e-risco-para-operadores.html",""
"12 de fevereiro de 2004.","Pesquisa testa métodos alternativos de aplicação de drogas oftálmicas em áreas profundas do globo ocular","Desenvolvimento e caracterização de microemulsões e de implantes biodegradáveis para aplicação oftálmica","Canal Ciencia - IBICT","http://www.canalciencia.ibict.br/pesquisa/0198-Metodos-alternativos-de-aplicacao-de-drogas-oftalmicas.html",""
"04 de dezembro de 2003.","Pesquisa testa sistema de diagnóstico automático que detecta diferenças entre mamografias para prevenir tumores","Medição de assimetria em imagens mamográficas","Canal Ciencia - IBICT","http://www.canalciencia.ibict.br/pesquisa/0185-Diagnostico-automatico-do-cancer-de-mama.html",""
"17 de novembro de 2003.","Pesquisadores avaliam potencial tóxico e de dano genético do chorume produzido em aterros sanitários","Determinação do potencial tóxico e genotóxico de líquido percolado gerado em aterramento de resíduos sólidos urbanos","Canal Ciencia - IBICT","http://www.canalciencia.ibict.br/pesquisa/0170-Potencial-toxico-do-chorume-em-aterros-sanitarios.html",""
"03 de julho de 2003.","Pesquisadores buscam fontes alternativas de matéria-prima (potássio) para produção de fertilizantes","Fontes Alternativas de Potássio para Fertilizantes","Canal Ciencia - IBICT","http://www.canalciencia.ibict.br/pesquisa/0126-Fontes-alternativas-de-potassio-para-producao-de-fertilizantes.html",""
"30 de setembro de 2003.","Pesquisadores criam modelo computacional para compreender o crescimento de tumores","Modelagem Computacional sobre Crescimento Tumoral","Canal Ciencia - IBICT","http://www.canalciencia.ibict.br/pesquisa/0158-Modelo-computacional-sobre-crescimento-de-tumores.html",""
"11 de julho de 2003.","Pesquisadores desenvolvem novas aplicações tecnológicas para minerais usados como fertilizantes e corretores de solos","Inovação tecnológica no uso de minerais industriais na agricultura","Canal Ciencia - IBICT","http://www.canalciencia.ibict.br/pesquisa/0127-Aplicacoes-tecnologicas-minerais-fertilizantes-corretores-solos.html",""
"sem data","Pesquisadores desenvolvem processo de produção de areia artificial que beneficia construção civil e preserva a natureza","","Canal Ciencia - IBICT","http://www.canalciencia.ibict.br/pesquisa/0210-Areia-artificial-preserva-natureza.html",""
"22 de setembro de 2003.","Pesquisadores desenvolvem tecnologia mais segura e econômica para testar os calibradores das doses de radiação administradas na medicina nuclear","Desenvolvimento de Sistema para Teste de Linearidade de Calibradores de Dose","Canal Ciencia - IBICT","http://www.canalciencia.ibict.br/pesquisa/0155-Desenvolvimento-de-calibradores-de-radiacao-na-medicina-nuclear.html",""
"09 de setembro de 2003.","Pesquisadores discutem métodos para estudo do crescimento e determinação da idade em árvores da floresta tropical","Relações entre crescimento diamétrico e idade em populações de espécies arbóreas tropicais","Canal Ciencia - IBICT","http://www.canalciencia.ibict.br/pesquisa/0151-Crescimento-e-idade-de-arvores-da-floresta-tropical.html",""
"22 de setembro de 2003.","Pesquisadores estudam a adaptação de um tubo de Raios X com alvo de tungstênio para realização de pesquisas em mamografia","Adaptação de um sistema de Raios X com ânodo de tungstênio e potencial constante para a faixa de mamografia","Canal Ciencia - IBICT","http://www.canalciencia.ibict.br/pesquisa/0154-RaiosX-tungstenio-mamografia.html",""
"31 de janeiro de 2004.","Pesquisadores estudam código genético de fungo patogênico para compreender sua capacidade de infecção e propor terapias","Epidemiologia de Cryptococcus neoformans: aspectos moleculares","Canal Ciencia - IBICT","http://www.canalciencia.ibict.br/pesquisa/0193-Codigo-genetico-de-fungo-patogenico.html",""
"22 de janeiro de 2004.","Pesquisadores estudam uso de materiais alternativos para baratear custo de casas populares no Brasil","","Canal Ciencia - IBICT","http://www.canalciencia.ibict.br/pesquisa/0190-Casas-populares-para-populacao-de-baixa-renda.html",""
"26 de novembro de 2003.","Pesquisadores instalam recifes artificiais no litoral fluminense para avaliar seu uso como forma de melhoria da pesca","Papel funcional de um recife artificial no litoral norte do estado do Rio de Janeiro","Canal Ciencia - IBICT","http://www.canalciencia.ibict.br/pesquisa/0173-Recifes-artificiais-litoral-fluminense-e-melhorias-na-pesca.html",""
"22 de janeiro de 2003.","Pesquisas ajudam a avaliar dose correta de radiação em exames de mamografia com aparelhos de raios-X","Implementação e análise de incertezas de um sistema de calibração para mamografia","Canal Ciencia - IBICT","http://www.canalciencia.ibict.br/pesquisa/0099-Dose-radiacao-exames-de-mamografia.html",""
"11 de dezembro de 2002.","Pesquisas ajudam a combater doenças dos índios Yanomami e Ye’Kuana","Oncocercose, uma endemia possível de ser eliminada","Canal Ciencia - IBICT","http://www.canalciencia.ibict.br/pesquisa/0075-Doencas-indios-Yanomami-YeKuana.html",""
"17 de abril de 2003.","Plantas com potencial biológico e cosmético na Amazônia","Plantas amazônicas com potencial biológico e cosmético","Canal Ciencia - IBICT","http://www.canalciencia.ibict.br/pesquisa/0112-Plantas-da-amazonia-com-potencial-biologico-e-cosmetico.html",""
"30 de outubro 2013","Plásticos condutores","Dinâmica de Quase-Partículas em Polímeros Condutores","Canal Ciencia - IBICT","http://www.canalciencia.ibict.br/pesquisa/0256-Plasticos-Condutores.html",""
"24 de dezembro de 2014.","Por que existe tanta diversidade de aves nas florestas tropicais?","The drivers of tropical speciation","Canal Ciencia - IBICT","http://www.canalciencia.ibict.br/pesquisa/0272-Diversidade-de-aves-nas-florestas-tropicais.html",""
"sem data","Por que são feitas tantas cesarianas no Brasil?","Fatores associados à cesariana segundo fonte de financiamento na região Sudeste: estudo transversal a partir dos dados da pesquisa “Nascer no Brasil: Inquérito Nacional sobre Parto e Nascimento”.","Canal Ciencia - IBICT","http://www.canalciencia.ibict.br/pesquisa/0284_Fatores_que_influenciam_a_cesariana_na_regiao_Sudeste.html",""
"28 de agosto de 2003.","Programa de controle de qualidade para equipamentos de irradiação usados em tratamentos de tumores cerebrais","Proposta de Um Programa de Controle da Qualidade em Serviços que utilizem Aceleradores Lineares para Radiocirurgia Estereotáxica","Canal Ciencia - IBICT","http://www.canalciencia.ibict.br/pesquisa/0148-Controle-qualidade-de-equipamentos-tratamentos-tumores-cerebrais.html",""
"9 de julho de 2012.","Proteção de albatrozes e petréis contra a captura pela pesca de espinhel","Avaliação de medidas mitigadoras para reduzir a captura não intencional dos albatrozes e petréis","Canal Ciencia - IBICT","http://www.canalciencia.ibict.br/pesquisa/0249-Projeto-Albatroz.html",""
"1 de julho de 2015.","Pães sem glúten também podem ser gostosos","Aplicações de técnicas de planejamento experimental e análise de superfície de resposta para otimização das propriedades tecnológicas, nutricionais e sensoriais de formulações de pães sem glúten. ","Canal Ciencia - IBICT","http://www.canalciencia.ibict.br/pesquisa/0282_Paes_sem_gluten_deliciosamente_saudaveis.html",""
"15 de julho de 2014.","Quantidade de neurônios explica a superioridade da inteligência humana","O cérebro de elefante em números","Canal Ciencia - IBICT","http://www.canalciencia.ibict.br/pesquisa/0267-Quantidade-neuronios-explica-superioridade-inteligencia-humana.html",""
"27 de abril de 2015.","Queijo com casca de jabuticaba, inovação que faz bem à saúde","Avaliação microbiológica, físico-química e sensorial de ","Canal Ciencia - IBICT","http://www.canalciencia.ibict.br/pesquisa/0278_Queijo_com_casa_de_jabuticaba.html",""
"21 de novembro de 2007.","Reaproveitamento de garrafas PET pelo Instituto Nacional de Tecnologia","Desenvolvimento de produtos utilizando garrafas PET descartadas","Canal Ciencia - IBICT","http://www.canalciencia.ibict.br/pesquisa/0227-Reaproveitamento-garrafas-PET.html",""
"12 de outubro de 2013.","Redescobrindo o tatu-canastra no Pantanal","Projeto  Tatu-canastra","Canal Ciencia - IBICT","http://www.canalciencia.ibict.br/pesquisa/0254-Projeto-Tatu-Canastra.html",""
"26 de novembro de 2008.","Reservatórios de contenção de cheias assumem formas de criadouros de mosquitos e ameaçam a saúde pública em São Paulo","Estudo da fauna de mosquitos (Díptera: Culicidae) em Reservatórios de Contenção de Cheias em área metropolitana na cidade de São Paulo, SP.","Canal Ciencia - IBICT","http://www.canalciencia.ibict.br/pesquisa/0234-Reservatorios-contencao-cheias-mosquitos-saude-publica.html",""
"7 de maio de 2014","Satélite de olho na produção de cana-de-açucar","Studies on the rapid expansion of sugarcane for ethanol production in São Paulo state (Brazil) using Landsat data . (Estudos sobre a rápida expansão da cultura da cana-de-açúcar para a produção de etanol no estado de São Paulo (Brasil) com dados de satélites Landsat).","Canal Ciencia - IBICT","http://www.canalciencia.ibict.br/pesquisa/0260-Sensoriamento-remoto-da-producao-de-cana-de-acucar.html",""
"16 de março de 2004.","Segurança da concentração de nitrato em cultivos hidropônicos do alface é pesquisada em Rondônia","Acúmulo de nitrato em cultivares de alface (Lactuca sativa) em sistema hidropônico","Canal Ciencia - IBICT","http://www.canalciencia.ibict.br/pesquisa/0207-Concentracao-nitrato-cultivos-hidroponicos-do-alface-em-Rondonia.html",""
"10 de novembro de 2005.","Sistema criado no Paraná possibilita melhor gerenciamento de informações","Informatização do processo de atendimento a consultorias em transferência de tecnologia: caso de uma universidade empreendedora","Canal Ciencia - IBICT","http://www.canalciencia.ibict.br/pesquisa/0219-Sistema-de-informacao-para-transferencia-de-tecnologia.html",""
"22 de dezembro de 2011.","Sustentabilidade da exploração de impacto reduzido na Amazônia Oriental","Sustentabilidade da exploração de impacto reduzido na Amazônia Oriental","Canal Ciencia - IBICT","http://www.canalciencia.ibict.br/pesquisa/0246-Sustentabilidade-exploracao-madeira-impacto-reduzido-na-Amazonia.html",""
"31 de agosto de 2015.","Tecnologia inovadora permite avaliar a segurança de estruturas","Tecnologia permite avaliar a segurança de estruturas","Canal Ciencia - IBICT","http://www.canalciencia.ibict.br/pesquisa/0288_Avaliacao_da_seguranca_de_estruturas.html",""
"10 de dezembro de 2002.","Tecnologias apropriadas para a agroindústria na Amazônia","Tecnologias apropriadas para agroindústria na Amazônia","Canal Ciencia - IBICT","http://www.canalciencia.ibict.br/pesquisa/0066-Tecnologias-apropriadas-agroindustria-na-Amazonia.html",""
"03 de dezembro de 2003.","Tecnologias para aproveitar resíduos poluentes de granito e borracha na construção civil","Utilização de resíduos industriais para confecção de tijolos e telhas","Canal Ciencia - IBICT","http://www.canalciencia.ibict.br/pesquisa/0179-Tecnologias-para-aproveitar-residuos-poluentes.html",""
"07 de dezembro de 2002.","Telescópio Gemini observa matéria ejetada na explosão de uma Nova","O envoltório em torno da Nova Cassiopéia 1993","Canal Ciencia - IBICT","http://www.canalciencia.ibict.br/pesquisa/0052-Telescopio-Gemini-registra-explosao-de-Nova.html",""
